url_code,title,url,annotation
B0006DQHQM,"Dental Fresh Water Additive for Pets - Clinically Proven, Simply Add to Pet’s Water Bowl to Whiten Teeth",http://www.amazon.com/Dental-Fresh-Water-Additive-Clinically/dp/B0006DQHQM/ref=sr_1_10?dchild=1&keywords=rabies+vaccine&qid=1588478935&sr=8-10&swrs=4714AB0DC332E55D185D0D320347E52A,0
B087Q122QC,"Hitecera Veterinarian Prepare Syringe Vaccine Injection for Dog.Thailand,Art Print for Office Rabies Art Print for Office 12x12in",http://www.amazon.com/Hitecera-Veterinarian-Injection-Dog-Thailand-Art/dp/B087Q122QC/ref=sr_1_9?dchild=1&keywords=rabies+vaccine&qid=1588480143&sr=8-9,0
B0884KRD93,"Personal Health Logbook: Personal Health Organizer - Comprehensive medical and health record book for organizing your medical history, health records, and doctor visits",http://www.amazon.com/Personal-Health-Logbook-Comprehensive-organizing/dp/B0884KRD93/ref=sr_1_1?dchild=1&keywords=immunization+record+book&qid=1588946572&sr=8-1&swrs=111B0FA938165B05D5031A5C1E420D77,0
B0884K73BQ,Personal Health Logbook: Professional Health Logbook - Personal Organizer to Keep Track of All Your Medical Information and Doctor Visits,http://www.amazon.com/Personal-Health-Logbook-Professional-Information/dp/B0884K73BQ/ref=sr_1_2?dchild=1&keywords=immunization+record+book&qid=1588946572&sr=8-2&swrs=111B0FA938165B05D5031A5C1E420D77,0
B0884JG9WF,Personal Health Logbook: Professional Health Logbook - Personal Organizer to Keep Track of All Your Medical Information and Doctor Visits,http://www.amazon.com/dp/B0884JG9WF/ref=sr_1_3?dchild=1&keywords=immunization+record+book&qid=1588946572&sr=8-3&swrs=111B0FA938165B05D5031A5C1E420D77,0
B0884CHYPP,Personal Health Logbook: Professional Health Logbook - Personal Organizer to Keep Track of All Your Medical Information and Doctor Visits,http://www.amazon.com/Personal-Health-Logbook-Professional-Information/dp/B0884CHYPP/ref=sr_1_4?dchild=1&keywords=immunization+record+book&qid=1588946572&sr=8-4&swrs=111B0FA938165B05D5031A5C1E420D77,0
B0884CHYPK,My Medical Records: Personal Health Logbook - Professional Organizer to Keep Track of All Your Medical Information.,http://www.amazon.com/Medical-Records-Professional-Organizer-Information/dp/B0884CHYPK/ref=sr_1_5?dchild=1&keywords=immunization+record+book&qid=1588946572&sr=8-5&swrs=111B0FA938165B05D5031A5C1E420D77,0
B0884RHZT1,"My Child's Health Log Book: Medical Journal, immunization record, Vaccine Record Log, Children’s Healthcare Information, Symptoms, Growth, Baby Health ... History Tracker Logbook Seize 8 X 10 in",http://www.amazon.com/Childs-Health-Log-Book-immunization/dp/B0884RHZT1/ref=sr_1_6?dchild=1&keywords=immunization+record+book&qid=1588946572&sr=8-6&swrs=111B0FA938165B05D5031A5C1E420D77,0
B0884RG2VZ,"My Child's Health Log Book: Medical Journal, immunization record, Vaccine Record Log, Children’s Healthcare Information, Symptoms, Growth, Baby Health ... History Tracker Logbook Seize 8 X 10 in",http://www.amazon.com/Childs-Health-Log-Book-immunization/dp/B0884RG2VZ/ref=sr_1_7?dchild=1&keywords=immunization+record+book&qid=1588946572&sr=8-7&swrs=111B0FA938165B05D5031A5C1E420D77,0
B0884L92PZ,"baby log book: Medical Journal, immunization record, Vaccine Record Log, Children’s Healthcare Information, Symptoms, Growth, Baby Health Log Note Treatment History Tracker Logbook Seize 8 X 10 in",http://www.amazon.com/baby-log-book-immunization-Information/dp/B0884L92PZ/ref=sr_1_8?dchild=1&keywords=immunization+record+book&qid=1588946572&sr=8-8&swrs=111B0FA938165B05D5031A5C1E420D77,0
B0884KRCW3,"My Child's Health Log Book: Medical Journal, immunization record, Vaccine Record Log, Children’s Healthcare Information, Symptoms, Growth, Baby Health ... History Tracker Logbook Seize 8 X 10 in",http://www.amazon.com/Childs-Health-Log-Book-immunization/dp/B0884KRCW3/ref=sr_1_9?dchild=1&keywords=immunization+record+book&qid=1588946572&sr=8-9&swrs=111B0FA938165B05D5031A5C1E420D77,0
B0884KR2X5,"baby log book: Medical Journal, immunization record, Vaccine Record Log, Children’s Healthcare Information, Symptoms, Growth, Baby Health Log Note Treatment History Tracker Logbook Seize 8 X 10 in",http://www.amazon.com/dp/B0884KR2X5/ref=sr_1_10?dchild=1&keywords=immunization+record+book&qid=1588946572&sr=8-10&swrs=111B0FA938165B05D5031A5C1E420D77,0
B0721PR375,"Hepatitis B and D Protocols, Volume I: Detection, Genotypes, and Characterization",http://www.amazon.com/Hepatitis-Protocols-Detection-Genotypes-Characterization/dp/B0721PR375/ref=sr_1_7?dchild=1&keywords=hepatitis+b&qid=1589551390&sr=8-7,0
1796337218,"My Cat's Health Records: Cat Vaccination Record Book, Cat Immunization Log, Shots Record Card, Kitten Vaccine Book, Vaccine Book Record, Cats Medical ... Perfect Gift for Cat Owners and Lovers",http://www.amazon.com/Cats-Health-Records-Vaccination-Immunization/dp/1796337218/ref=sr_1_10?dchild=1&keywords=immunization+book&qid=1589565635&sr=8-10,0
B001BGTRII,IVIG Therapy Today (Allergy and Immunology Book 2),http://www.amazon.com/IVIG-Therapy-Today-Allergy-Immunology-ebook/dp/B001BGTRII/ref=sr_1_10?dchild=1&keywords=immunization+book&qid=1589566601&sr=8-10,0
B001ES8GGC,Sambucol Black Elderberry Cold & Flu Relief Tablets 30 ct,http://www.amazon.com/Sambucol-Elderberry-Homeopathic-Temporary-Flu-like/dp/B001ES8GGC/ref=sr_1_8?dchild=1&keywords=flu&qid=1588745136&sr=8-8,0
B01HI7WQRW,"Tylenol Cold + Flu Severe Day & Night Caplets for Fever, Pain, Cough & Congestion Relief, 24 ct.",http://www.amazon.com/Tylenol-Severe-Night-Caplets-Count/dp/B01HI7WQRW/ref=sr_1_10?dchild=1&keywords=flu&qid=1588831537&sr=8-10,0
B087YLGLHX,The 1918 Spanish Flu: The Tragic History of  the Massive Influenza Outbreak,http://www.amazon.com/1918-Spanish-Flu-Influenza-Outbreak-ebook/dp/B087YLGLHX/ref=sr_1_10?dchild=1&keywords=vaccination+book&qid=1588411087&sr=8-10,0
B01M0HUMBQ,Durvet Ivermectin Paste Equine Dewormer - 12 Pack,http://www.amazon.com/Durvet-Ivermectin-Paste-Equine-Dewormer/dp/B01M0HUMBQ/ref=sr_1_10?dchild=1&keywords=rabies+vaccine&qid=1589515235&sr=8-10,0
B079JX3FMC,Milk Thistle 1000mg Silymarin Marianum & Dandelion Root Liver Health Support 120 Capsules,http://www.amazon.com/gp/slredirect/picassoRedirect.html/ref=pa_sp_atf_aps_sr_pg1_1?ie=UTF8&adId=A002316624K4EMT2Y5X2F&url=%2FBronson-Milk-Thistle-1000mg-Capsules%2Fdp%2FB079JX3FMC%2Fref%3Dsr_1_1_sspa%3Fdchild%3D1%26keywords%3Dhepatitis%2Bb%26qid%3D1588944031%26sr%3D8-1-spons%26psc%3D1&qualifier=1588944031&id=3267038634999723&widgetName=sp_atf,0
1980864918,"The Art of Intermittent Fasting: How to Lose Weight, Shed Fat, and Live a Healthier Life",http://www.amazon.com/Art-Intermittent-Fasting-Weight-Healthier/dp/1980864918/ref=sr_1_7?dchild=1&keywords=hepatitis+b&qid=1588947820&sr=8-7&swrs=BB180F0C545967555F52E33E350526E5,0
B088N3WW83,"Weight Watchers Freestyle Cookbook: Tasty, Quick and Easy Recipes | 21 Day Meal Plan",http://www.amazon.com/gp/slredirect/picassoRedirect.html/ref=pa_sp_mtf_aps_sr_pg1_2?ie=UTF8&adId=A04495231XJZ9SU8LLQTS&url=%2FWeight-Watchers-Freestyle-Cookbook-Recipes%2Fdp%2FB088N3WW83%2Fref%3Dsr_1_10_sspa%3Fdchild%3D1%26keywords%3Dimmunization%2Brecord%2Bbook%26qid%3D1589635832%26sr%3D8-10-spons%26psc%3D1&qualifier=1589635832&id=2338987778281057&widgetName=sp_mtf,0
B01BMF1G8G,"NatureWise Liver Cleanse Premium Detox (2 Month Supply) Advanced Triple Formula Liver Detoxifier, Regenerator, and Protector - Natural Herbal Supplements, Milk Thistle, Turmeric Curcumin [120 Count]",http://www.amazon.com/NatureWise-Detoxifier-Regenerator-Protector-Supplements/dp/B01BMF1G8G/ref=sr_1_8?dchild=1&keywords=hepatitis+b&qid=1589116833&sr=8-8,0
B01FH6QNTS,"Genexa Flu Fix – 60 Tablets | Certified Organic & Non-GMO, Physician Formulated, Homeopathic | Multi-Symptom Flu Medicine",http://www.amazon.com/gp/slredirect/picassoRedirect.html/ref=pa_sp_atf_aps_sr_pg1_2?ie=UTF8&adId=A04117191HRRTIEWTGPNF&url=%2FGenexa-Flu-Medicine-Homeopathic-Multi-Symptom%2Fdp%2FB01FH6QNTS%2Fref%3Dsr_1_2_sspa%3Fdchild%3D1%26keywords%3Dflu%26qid%3D1588917933%26sr%3D8-2-spons%26psc%3D1&qualifier=1588917933&id=960171861000869&widgetName=sp_atf,0
B01LZ8VO56,Micro- and Nanotechnology in Vaccine Development (Micro and Nano Technologies),http://www.amazon.com/Micro-Nanotechnology-Vaccine-Development-Technologies-ebook/dp/B01LZ8VO56/ref=sr_1_7?dchild=1&keywords=hepatitis+vaccine&qid=1588721817&sr=8-7&swrs=1CC87AE320511811F03122B717A3936C,0
B004J4X32U,The Whole-Brain Child: 12 Revolutionary Strategies to Nurture Your Child's Developing Mind,http://www.amazon.com/Whole-Brain-Child-Revolutionary-Strategies-Developing-ebook/dp/B004J4X32U/ref=sr_1_7?dchild=1&keywords=vaccine+free+me+book&qid=1588660227&sr=8-7,0
B082MQL3G9,Revive MD | Liver | Premium Liver Health Supplement for Men and Women | Improves Liver Function | Aids with Overall Health | Supports Liver Enzymes | Increases Bile Flow | 120 Capsules,http://www.amazon.com/gp/slredirect/picassoRedirect.html/ref=pa_sp_atf_aps_sr_pg1_4?ie=UTF8&adId=A0001176207ODZKSX18VB&url=%2FRevive-MD-Supplement-Improves-Increases%2Fdp%2FB082MQL3G9%2Fref%3Dsr_1_4_sspa%3Fdchild%3D1%26keywords%3Dhepatitis%2Bb%26qid%3D1588857632%26sr%3D8-4-spons%26psc%3D1%26smid%3DA24YZWGRMKUFLP&qualifier=1588857632&id=4723455835829495&widgetName=sp_atf,0
3319328875,Handbook of Electroporation,http://www.amazon.com/Handbook-Electroporation-Damijan-Miklav%C4%8Di%C4%8D/dp/3319328875/ref=sr_1_1?dchild=1&keywords=vaccination&qid=1589636436&sr=8-1,0
3527312609,"Handbook of Meningococcal Disease: Infection Biology, Vaccination, Clinical Management",http://www.amazon.com/Handbook-Meningococcal-Disease-Vaccination-Management/dp/3527312609/ref=sr_1_5?dchild=1&keywords=vaccination&qid=1589636436&sr=8-5,0
1379207878,Propagation of Fowl- And Pigeon-Pox Viruses in Avian Eggs and Use of Egg-Cultivated Viruses for Immunization,http://www.amazon.com/Propagation-Pigeon-Pox-Viruses-Egg-Cultivated-Immunization/dp/1379207878/ref=sr_1_10?dchild=1&keywords=immunization&qid=1589307333&sr=8-10,0
B088KLLV57,"Aqua Sensory Water Bed Pillow Vestibular Autism Special Needs Mat - 31"" x 40"" | Gravefloweringhol",http://www.amazon.com/dp/B088KLLV57/ref=sr_1_4?dchild=1&keywords=autism&qid=1589433793&sr=8-4,0
B088KJ87XH,"Aqua Sensory Water Bed Pillow Vestibular Autism Special Needs Mat - 31"" x 40""",http://www.amazon.com/dp/B088KJ87XH/ref=sr_1_5?dchild=1&keywords=autism&qid=1589433793&sr=8-5,0
B081PV6ZXP,"AnanBros Room Decor Kids Night Light with Lamp Mode and Projection Mode, Rotating Star Projector with 9 Color Options, Sensory Toys for Autism, Baby Star Light for Christmas, Birthday and Party",http://www.amazon.com/AnanBros-Projection-Rotating-Projector-Christmas/dp/B081PV6ZXP/ref=sr_1_10?dchild=1&keywords=autism&qid=1589515240&sr=8-10,0
B087L8DWVD,"The Great Spanish Influenza Pandemic Of 1918: The History of the Deadliest Spanish Flu that Devastated the World, Myths, Symptoms, Outbreak, Lessons, and Origin of the Name",http://www.amazon.com/Great-Spanish-Influenza-Pandemic-1918/dp/B087L8DWVD/ref=sr_1_10?dchild=1&keywords=influenza+vaccine&qid=1588514576&sr=8-10&swrs=FEA4D9FBA814CDADFA61119964D06328,0
B087ZTHGMG,got hepatization? - Men's Soft & Comfortable T-Shirt,http://www.amazon.com/US-C-19-20-01-026248-01-13-02-05/dp/B087ZTHGMG/ref=sr_1_8?dchild=1&keywords=hepatitis+a&qid=1588891512&sr=8-8&swrs=8863D132E68AB28855A65D5379D2998C,0
B087P167DH,#hepatitis - Men's Soft & Comfortable Hashtag V-Neck T-Shirt,http://www.amazon.com/hepatitis-Comfortable-Hashtag-T-Shirt-X-Large/dp/B087P167DH/ref=sr_1_9?dchild=1&keywords=hepatitis+a&qid=1588891512&sr=8-9&swrs=8863D132E68AB28855A65D5379D2998C,0
B087N355N9,got hepatitis? - Men's Soft & Comfortable V-Neck T-Shirt,http://www.amazon.com/got-hepatitis-Comfortable-T-Shirt-XX-Large/dp/B087N355N9/ref=sr_1_10?dchild=1&keywords=hepatitis+a&qid=1588891512&sr=8-10&swrs=8863D132E68AB28855A65D5379D2998C,0
B00BXIQ8CW,Durvet 12-Pack Ivermectin Dewormer Paste for Horses,http://www.amazon.com/Durvet-12-Pack-Ivermectin-Dewormer-Horses/dp/B00BXIQ8CW/ref=sr_1_5?dchild=1&keywords=rabies+vaccine&qid=1589347609&sr=8-5,0
B00T3R6ICA,"MEASLES: Quick Facts about This Resurfacing Disease (Illnesses, Disorders, and Diseases That Afflict the World Book 2)",http://www.amazon.com/MEASLES-Resurfacing-Illnesses-Disorders-Diseases-ebook/dp/B00T3R6ICA/ref=sr_1_4?dchild=1&keywords=measles&qid=1588393210&sr=8-4&swrs=40B94520CEF72F0AA180DF2BF7FDC1C5,0
B07TV6LKPN,Add 15 Years | Economic Crisis Leading to Medical Crisis: Why Healthcare in Venezuela Collapsed Due to Economic Crisis? (English),http://www.amazon.com/Adding-years-our-Life-course-ebook/dp/B07TV6LKPN/ref=sr_1_5?dchild=1&keywords=measles&qid=1588393210&sr=8-5&swrs=40B94520CEF72F0AA180DF2BF7FDC1C5,0
B071X9KRJ3,Health: How to Prevent Measles,http://www.amazon.com/Health-Prevent-Measles-ROBERT-HANS-ebook/dp/B071X9KRJ3/ref=sr_1_6?dchild=1&keywords=measles&qid=1588393210&sr=8-6&swrs=40B94520CEF72F0AA180DF2BF7FDC1C5,0
B086Z5K7DN,"An Essay on Contagious Diseases: More Particularly on the Small-Pox, Measles, Putrid, Malignant, and Pestilential Fevers",http://www.amazon.com/Essay-Contagious-Diseases-Particularly-Pestilential-ebook/dp/B086Z5K7DN/ref=sr_1_8?dchild=1&keywords=measles&qid=1588393210&sr=8-8&swrs=40B94520CEF72F0AA180DF2BF7FDC1C5,0
B0007HQ528,"Have a happy measle, a merry mumps, and a cheery chickenpox",http://www.amazon.com/happy-measle-merry-cheery-chickenpox/dp/B0007HQ528/ref=sr_1_1?dchild=1&keywords=measles&qid=1588394333&sr=8-1,0
1119467764,Infections of the Central Nervous System: Pathology and Genetics (International Society of Neuropathology Series),http://www.amazon.com/Infections-Central-Nervous-System-Neuropathology/dp/1119467764/ref=sr_1_10?dchild=1&keywords=measles&qid=1588394333&sr=8-10,0
B01AMSJV18,In a Different Key: The Story of Autism,http://www.amazon.com/Different-Key-Story-Autism/dp/B01AMSJV18/ref=sr_1_5?dchild=1&keywords=measles&qid=1588395547&sr=8-5,0
B014RWV2OE,A Planet of Viruses: Second Edition,http://www.amazon.com/Planet-Viruses-Second-Carl-Zimmer-ebook/dp/B014RWV2OE/ref=sr_1_9?dchild=1&keywords=measles&qid=1588395547&sr=8-9,0
B0878WX9GR,"Communicable disease threats report, 12-18 April 2020, week 16",http://www.amazon.com/Communicable-disease-threats-report-12-18-ebook/dp/B0878WX9GR/ref=sr_1_4?dchild=1&keywords=measles&qid=1588396868&sr=8-4&swrs=E43B4AA288F774E5FA12CA80FDFF0F8D,0
B086KR1K6Y,"Stricter Quarantine Regulations For Measles Outbreaks In New York State, 1908-1951",http://www.amazon.com/Stricter-Quarantine-Regulations-Outbreaks-1908-1951-ebook/dp/B086KR1K6Y/ref=sr_1_8?dchild=1&keywords=measles&qid=1588396868&sr=8-8&swrs=E43B4AA288F774E5FA12CA80FDFF0F8D,0
B086K2T5H1,Measles Surveillance Report 2007,http://www.amazon.com/Measles-Surveillance-European-Disease-Prevention-ebook/dp/B086K2T5H1/ref=sr_1_9?dchild=1&keywords=measles&qid=1588396868&sr=8-9&swrs=E43B4AA288F774E5FA12CA80FDFF0F8D,0
B086K27KYH,Measles Surveillance Report 2006,http://www.amazon.com/Measles-Surveillance-European-Disease-Prevention-ebook/dp/B086K27KYH/ref=sr_1_10?dchild=1&keywords=measles&qid=1588396868&sr=8-10&swrs=E43B4AA288F774E5FA12CA80FDFF0F8D,0
1521015678,Dog Vaccination Record Book: Pet Log Book,http://www.amazon.com/Dog-Vaccination-Record-Book-Pet/dp/1521015678/ref=sr_1_1?dchild=1&keywords=immunization+record+book&qid=1589117940&sr=8-1,0
1509515895,Security and Public Health,http://www.amazon.com/gp/slredirect/picassoRedirect.html/ref=pa_sp_mtf_aps_sr_pg1_1?ie=UTF8&adId=A08872982HUQV06LQJL6Q&url=%2FSecurity-Public-Health-Simon-Rushton%2Fdp%2F1509515895%2Fref%3Dsr_1_9_sspa%3Fdchild%3D1%26keywords%3Dimmunization%26qid%3D1588616132%26sr%3D8-9-spons%26psc%3D1&qualifier=1588616132&id=4203030168654666&widgetName=sp_mtf,0
B079ZC3T7H,"Equate 2 Pack of Gas Relief Prevention, Food Enzyme Dietary Supplement, 200 Count",http://www.amazon.com/Equate-Prevention-Dietary-Supplement-Compare/dp/B079ZC3T7H/ref=sr_1_10?dchild=1&keywords=hpv+vaccine+on+trial&qid=1589551160&sr=8-10,0
B07XN45DMN,ESSENTIALE FORTE N 300 mg Liver Support Protection SANOFI 90 caps,http://www.amazon.com/gp/slredirect/picassoRedirect.html/ref=pa_sp_atf_aps_sr_pg1_1?ie=UTF8&adId=A02425943GCTTZP89CTV&url=%2FESSENTIALE-FORTE-Support-Protection-SANOFI%2Fdp%2FB07XN45DMN%2Fref%3Dsr_1_1_sspa%3Fdchild%3D1%26keywords%3Dhepatitis%2Bb%26qid%3D1589462434%26sr%3D8-1-spons%26psc%3D1&qualifier=1589462434&id=4322718800863436&widgetName=sp_atf,0
B086C9JR73,"crux RECOVER - Energy Drink Effervescent Tablets to Support Workout Recovery, Muscle Soreness, and Hangover Recovery with Acetyl L-Carnitine, Milk Thistle and Matcha (3 Tubes - 8 Servings Per Tube)",http://www.amazon.com/gp/slredirect/picassoRedirect.html/ref=pa_sp_atf_aps_sr_pg1_4?ie=UTF8&adId=A07038651RUZCF3WEIK5U&url=%2Fcrux-RECOVER-Effervescent-Recovery-L-Carnitine%2Fdp%2FB086C9JR73%2Fref%3Dsr_1_4_sspa%3Fdchild%3D1%26keywords%3Dhepatitis%2Bb%26qid%3D1589462434%26sr%3D8-4-spons%26psc%3D1&qualifier=1589462434&id=4322718800863436&widgetName=sp_atf,0
B07NV1PMTC,Turmeric Curcumin with Bioperine Supplement - Natural Anti-Inflammatory & Antioxidant Aid Non GMO Supplement for Men and Women,http://www.amazon.com/Turmeric-Curcumin-Bioperine-Supplement-Anti-Inflammatory/dp/B07NV1PMTC/ref=sr_1_10?dchild=1&keywords=hepatitis+b&qid=1589466356&sr=8-10,0
B015RTSDY8,An Introduction to Infectious Diseases,http://www.amazon.com/Influenza-Past-and-Future-Threat/dp/B015RTSDY8/ref=sr_1_8?dchild=1&keywords=flu&qid=1588400130&sr=8-8,0
B005PXYX0U,"Quantum Max Stress B - Probiotic-Fermented Vitamin B Formula for Dynamic Liver, Energy, Brain and Mood Support",http://www.amazon.com/Quantum-Max-Stress-Probiotic-Fermented-Vitamin/dp/B005PXYX0U/ref=sr_1_4?dchild=1&keywords=hepatitis+b+vaccine&qid=1589621950&sr=8-4,0
B004W6W44I,"Vitanica Hepafem, Liver Cleansing Support, Vegan, 60 Capsules",http://www.amazon.com/Vitanica-Hepafem-Cleansing-Support-Capsules/dp/B004W6W44I/ref=sr_1_5?dchild=1&keywords=hepatitis+b+vaccine&qid=1589621950&sr=8-5,0
B0006UICJA,"Source Naturals Prosta-Response, Supports Prostate Function and Healthy Urine Flow, 45 Tablets",http://www.amazon.com/Source-Naturals-Prosta-Response-Supports-Prostate/dp/B0006UICJA/ref=sr_1_6?dchild=1&keywords=hepatitis+b+vaccine&qid=1589621950&sr=8-6,0
B00075FPB2,Clear-Mind® Superior Mental Support Formula,http://www.amazon.com/Clear-Mind%C2%AE-Superior-Mental-Support-Formula/dp/B00075FPB2/ref=sr_1_8?dchild=1&keywords=hepatitis+b+vaccine&qid=1589621950&sr=8-8,0
B00KOUESB8,Eniva Heart Flow Super Bs Artery & Blood Vessel Care B Vitamin Blend Liquid Concentrate (32 oz),http://www.amazon.com/Eniva-Artery-Vessel-Vitamin-Concentrate/dp/B00KOUESB8/ref=sr_1_10?dchild=1&keywords=hepatitis+b+vaccine&qid=1589621950&sr=8-10,0
B01EVQYUPE,Ultra-Thin Medical Alert ID Bracelet with 2 GB USB Stainless Steel,http://www.amazon.com/Ultra-Thin-Medical-Alert-bracelet-Stainless/dp/B01EVQYUPE/ref=sr_1_10?dchild=1&keywords=immunization+record&qid=1588946507&sr=8-10,0
B015RTWI0S,An Introduction to Infectious Diseases,http://www.amazon.com/Malaria-and-Tuberculosis-Global-Killers/dp/B015RTWI0S/ref=sr_1_8?dchild=1&keywords=vaccine&qid=1589445930&sr=8-8,0
B007BK03JK,Quality of Life - Deodorex - 60 Vegicaps,http://www.amazon.com/gp/slredirect/picassoRedirect.html/ref=pa_sp_atf_aps_sr_pg1_1?ie=UTF8&adId=A07496623QG4D8VDYX1HQ&url=%2FQuality-Life-Detoxification-Deodorex-Vegicaps%2Fdp%2FB007BK03JK%2Fref%3Dsr_1_1_sspa%3Fdchild%3D1%26keywords%3Dhpv%26qid%3D1589236839%26sr%3D8-1-spons%26psc%3D1&qualifier=1589236839&id=4512927405721347&widgetName=sp_atf,0
B009ZRJA4Q,"Premium PQQ Supplement with CoQ10 – Quality of Life Enhanced VitaPQQ - Anti Aging, Memory, Energy and Focus, Cognitive and Heart Health - 30 Vegicaps",http://www.amazon.com/gp/slredirect/picassoRedirect.html/ref=pa_sp_atf_aps_sr_pg1_2?ie=UTF8&adId=A03836441NADF9XDH4N10&url=%2FQuality-Life-Enhanced-Vitapqq-Pound%2Fdp%2FB009ZRJA4Q%2Fref%3Dsr_1_2_sspa%3Fdchild%3D1%26keywords%3Dhpv%26qid%3D1589236839%26sr%3D8-2-spons%26psc%3D1&qualifier=1589236839&id=4512927405721347&widgetName=sp_atf,0
B07TPBM7M7,"Rabies Vaccine cookie cutter, 1 piece - Bakerlogy",http://www.amazon.com/gp/slredirect/picassoRedirect.html/ref=pa_sp_mtf_aps_sr_pg1_1?ie=UTF8&adId=A02617222VSBKQGSOT52N&url=%2FRabies-Vaccine-cookie-cutter-piece%2Fdp%2FB07TPBM7M7%2Fref%3Dsr_1_10_sspa%3Fdchild%3D1%26keywords%3Drabies%2Bvaccine%26qid%3D1588392035%26sr%3D8-10-spons%26psc%3D1&qualifier=1588392035&id=6638755143613410&widgetName=sp_mtf,0
B006OCG4JY,"L-Lysine Chews for Cats, Immune and Respiratory Support Supplement, 60 Bite Sized Chews (3.74oz)",http://www.amazon.com/L-Lysine-Immune-Respiratory-Support-Supplement/dp/B006OCG4JY/ref=sr_1_10?dchild=1&keywords=rabies+vaccine&qid=1588392586&sr=8-10,0
B0873D4WWW,"Health Armor | Maximum Immune Support Supplement, Created by Former NASA Doctor, 25 Immune-Boosting Ingredients | Easy to Swallow Tablets, 1-Month Supply (60 Count)",http://www.amazon.com/Maximum-Support-Supplement-Immune-Boosting-Ingredients/dp/B0873D4WWW/ref=sr_1_10?dchild=1&keywords=immunization&qid=1588531991&sr=8-10,0
B07FB7ZLGY,"SugarBearHair Women's Multi Vegan MultiVitamin with Glutathione, Vegan Omega-3, Folate, Vegan Collagen Booster Blend (1 Month Supply)",http://www.amazon.com/gp/slredirect/picassoRedirect.html/ref=pa_sp_atf_aps_sr_pg1_2?ie=UTF8&adId=A043042710997LT5X7NRO&url=%2FSugarBearHair-Womens-Multi-MultiVitamin-Supply%2Fdp%2FB07FB7ZLGY%2Fref%3Dsr_1_2_sspa%3Fdchild%3D1%26keywords%3Dautism%26qid%3D1588478437%26sr%3D8-2-spons%26psc%3D1%26smid%3DANLM9VGDHWW4V&qualifier=1588478437&id=3618137349052358&widgetName=sp_atf,0
9814324108,Inside the 2009 Influenza Pandemic,http://www.amazon.com/Inside-Influenza-Pandemic-Stuart-Abramson/dp/9814324108/ref=sr_1_8?dchild=1&keywords=influenza+vaccine&qid=1589418013&sr=8-8,0
B008UB7OGE,By Alfred W. Crosby - America's Forgotten Pandemic: The Influenza of 1918: 2nd (second) Edition,http://www.amazon.com/Alfred-W-Crosby-Forgotten-Influenza/dp/B008UB7OGE/ref=sr_1_4?dchild=1&keywords=influenza+vaccine&qid=1589419468&sr=8-4,0
B07MBJRRDN,CBS Evening News,http://www.amazon.com/4-24-CBS-Evening-News/dp/B07MBJRRDN/ref=sr_1_10?dchild=1&keywords=measles&qid=1589603927&sr=8-10,0
B088MYW3BH,One Legging it Around got Measles? - Leather Light Brown Patch Engraved Trucker Hat,http://www.amazon.com/Sling-Jab-Measles-Engraved-Heatherwhite/dp/B088MYW3BH/ref=sr_1_1?dchild=1&keywords=measles&qid=1589606227&sr=8-1,0
B088MKRNPP,One Legging it Around got Measle? - Leather Light Brown Patch Engraved Trucker Hat,http://www.amazon.com/Sling-Jab-Measle-Engraved-HeatherNavy/dp/B088MKRNPP/ref=sr_1_2?dchild=1&keywords=measles&qid=1589606227&sr=8-2,0
1548255890,"My Pet's Health & Wellness Log: Journal Notebook For Animal Lovers, Record Your Pet’s Daily Activities, Food Diet, Track Veterinaries Visit, ... Paperback (Pet Health Record) (Volume 10)",http://www.amazon.com/Pets-Health-Wellness-Log-Veterinaries/dp/1548255890/ref=sr_1_6?dchild=1&keywords=vaccination+book&qid=1589099970&sr=8-6,0
1719110514,"Dog Vaccination Record Book: Health Log Book, Vaccination Reminder, Vaccination Booklet, Vaccine Record Book For Dogs, Cute Veterinary Animals Cover (Volume 93)",http://www.amazon.com/Dog-Vaccination-Record-Book-Veterinary/dp/1719110514/ref=sr_1_8?dchild=1&keywords=vaccination+book&qid=1589099970&sr=8-8,0
B087YD326K,got measle? - Men's Ultra Soft Hoodie Sweatshirt,http://www.amazon.com/Plenum-Planting-measle-Hoodie-Sweatshirt/dp/B087YD326K/ref=sr_1_1?dchild=1&keywords=measles&qid=1588569187&sr=8-1,0
B087XSNZR7,got measles? - Men's Ultra Soft Hoodie Sweatshirt,http://www.amazon.com/Plenum-Planting-measles-Hoodie-Sweatshirt/dp/B087XSNZR7/ref=sr_1_2?dchild=1&keywords=measles&qid=1588569187&sr=8-2,0
B01N0SZ0MZ,The Vaccine-Friendly Plan: Dr. Paul's Safe and Effective Approach to Immunity and Health - from Pregnancy Through Your Child's Teen Years,http://www.amazon.com/Vaccine-Friendly-Plan-Effective-Approach-Pregnancy/dp/B01N0SZ0MZ/ref=sr_1_1?dchild=1&keywords=vaccination+book&qid=1588581570&sr=8-1,1
B005WK2HQS,The Vaccine Book: Making the Right Decision for Your Child (Sears Parenting Library),http://www.amazon.com/Vaccine-Book-Decision-Parenting-Library-ebook/dp/B005WK2HQS/ref=sr_1_2?dchild=1&keywords=vaccination+book&qid=1588581570&sr=8-2,1
B07NQW27VD,Miller's Review of Critical Vaccine Studies: 400 Important Scientific Papers Summarized for Parents and Researchers,http://www.amazon.com/Millers-Review-Critical-Vaccine-Studies-ebook/dp/B07NQW27VD/ref=sr_1_3?dchild=1&keywords=vaccination+book&qid=1588581570&sr=8-3,1
B00CWSONCE,"Vaccine Epidemic: How Corporate Greed, Biased Science, and Coercive Government Threaten Our Human Rights, Our Health, and Our Children",http://www.amazon.com/Vaccine-Epidemic-Corporate-Coercive-Government/dp/B00CWSONCE/ref=sr_1_4?dchild=1&keywords=vaccination+book&qid=1588581570&sr=8-4,1
B00REWL6YG,Thimerosal: Let the Science Speak: The Evidence Supporting the Immediate Removal of Mercury - a Known Neurotoxin - from Vaccines,http://www.amazon.com/Thimerosal-Evidence-Supporting-Immediate-Neurotoxin/dp/B00REWL6YG/ref=sr_1_6?dchild=1&keywords=vaccination+book&qid=1588581570&sr=8-6,1
B003ZHVBBC,"Vaccinations: A Thoughtful Parent's Guide: How to Make Safe, Sensible Decisions about the Risks, Benefits, and Alternatives",http://www.amazon.com/Vaccinations-Thoughtful-Sensible-Decisions-Alternatives-ebook/dp/B003ZHVBBC/ref=sr_1_7?dchild=1&keywords=vaccination+book&qid=1588581570&sr=8-7,1
1620872129,"Vaccine Epidemic: How Corporate Greed, Biased Science, and Coercive Government Threaten Our Human Rights, Our Health, and Our Children",http://www.amazon.com/gp/slredirect/picassoRedirect.html/ref=pa_sp_mtf_aps_sr_pg1_2?ie=UTF8&adId=A10074313N88NC55BXBDM&url=%2FVaccine-Epidemic-Corporate-Coercive-Government%2Fdp%2F1620872129%2Fref%3Dsr_1_10_sspa%3Fdchild%3D1%26keywords%3Dvaccination%2Bbook%26qid%3D1588581570%26sr%3D8-10-spons%26psc%3D1&qualifier=1588581570&id=7605095171072360&widgetName=sp_mtf,1
