url_code,title,url,annotation
B087XSQSXK,"En Sus manos: Corriendo sin piernas, volando sin alas (Spanish Edition)",http://www.amazon.com/En-Sus-manos-Corriendo-piernas-ebook/dp/B087XSQSXK/ref=sr_1_5?dchild=1&keywords=hepatitis&qid=1589433657&sr=8-5,4
B0872B4DKR,"Dr. Sebi Fasten: Entgiften Sie die Leber, reinigen und revitalisieren Sie den elektrischen Körper, um durch Diäten und Kräuter schlanke und umgekehrte Krankheiten zu erreichen (German Edition)",http://www.amazon.com/Dr-Sebi-Fasten-revitalisieren-elektrischen-ebook/dp/B0872B4DKR/ref=sr_1_8?dchild=1&keywords=hepatitis&qid=1588656060&sr=8-8,4
B08715LTV3,"Dr. Sebi Lebensmittel-Smoothies für Zellen: Perfekter Leitfaden für alkalische Diäten von Dr. Sebi zur Entgiftung von Leber,lebenswichtigen Organen,umgekehrten ... natürlich gesund bleiben (German Edition)",http://www.amazon.com/Dr-Sebi-Lebensmittel-Smoothies-Zellen-lebenswichtigen-ebook/dp/B08715LTV3/ref=sr_1_9?dchild=1&keywords=hepatitis&qid=1588656060&sr=8-9,4
B07F5YW5GJ,People who regret without striking: A way of life not involved in the vaccine controversy (jyeirubadobukkusu) (Japanese Edition),http://www.amazon.com/People-regret-without-striking-jyeirubadobukkusu-ebook/dp/B07F5YW5GJ/ref=sr_1_8?dchild=1&keywords=vaccine+controversy&qid=1588767660&sr=8-8&swrs=BCA334390E5E7793A2AD26F672626209,4
B086P32LXK,L'Industria della Vaccinazione: Storia e contro-Storia (Italian Edition),http://www.amazon.com/LIndustria-della-Vaccinazione-contro-Storia-Italian-ebook/dp/B086P32LXK/ref=sr_1_3?dchild=1&keywords=anti+vaccination&qid=1589606826&sr=8-3,4
9242549096,Vaccination Pratique: Guide à l'usage des personnels de santé - mise à jour 2015 (French Edition),http://www.amazon.com/Vaccination-Pratique-lusage-personnels-French/dp/9242549096/ref=sr_1_8?dchild=1&keywords=immunization&qid=1589568874&sr=8-8,4
B0753FW2YZ,DER MANN VOM GROSSEN FLUS - MO [Blu-ray],http://www.amazon.com/Mann-vom-grossen-Fluss/dp/B0753FW2YZ/ref=sr_1_1?dchild=1&keywords=flu&qid=1589178446&sr=8-1,4
B00GVB40OY,Kurzes Bewusstsein (German Edition),http://www.amazon.com/Kurzes-Bewusstsein-German-Andre-Bierre-ebook/dp/B00GVB40OY/ref=sr_1_10?dchild=1&keywords=hepatitis+a&qid=1589239737&sr=8-10,4
7117171316,Immunological basis of vaccination : measles. rubella . mumps(Chinese Edition),http://www.amazon.com/Immunological-basis-vaccination-measles-rubella/dp/7117171316/ref=sr_1_8?dchild=1&keywords=measles+vaccination&qid=1588910434&sr=8-8,4
B00B53JFGQ,Natur & (und) Heilen. 78.Jahrgang Heft 7 Juli 2001 : Schönheitspflege mit Meeresprodukten; Himmelsmedizin aus dem Bienenstock; Ayurveda gegen Hepatitis. Die Monatszeitschrift für gesundes Leben. Natur und Heilen: Ratgeber für gesundheitliche und naturhei,http://www.amazon.com/Natur-Heilen-78-Jahrgang-Heft-Monatszeitschrift/dp/B00B53JFGQ/ref=sr_1_8?dchild=1&keywords=hepatitis+b&qid=1588687369&sr=8-8,4
750234179X,Hepatitis B Diet [Paperback],http://www.amazon.com/Hepatitis-B-Diet-Paperback/dp/750234179X/ref=sr_1_10?dchild=1&keywords=hepatitis+b&qid=1588687369&sr=8-10,4
B01NA0EFI6,Die Hepatitis-Badewanne und andere Storys: Fan Edition (German Edition),http://www.amazon.com/Die-Hepatitis-Badewanne-andere-Storys-German-ebook/dp/B01NA0EFI6/ref=sr_1_5?dchild=1&keywords=hepatitis+a&qid=1589059829&sr=8-5,4
B08781WQW6,"Krankheiten: Übertragbare Krankheiten oder Infektionskrankheiten, Sexuell übertragbare Infektionen. (German Edition)",http://www.amazon.com/Krankheiten-%C3%9Cbertragbare-Infektionskrankheiten-%C3%BCbertragbare-Infektionen-ebook/dp/B08781WQW6/ref=sr_1_9?dchild=1&keywords=hepatitis&qid=1589002128&sr=8-9&swrs=39EA45B81B782DFF8EA34E53913A8446,4
B0761W7MXJ,Shishu Health Guide (Hindi Edition),http://www.amazon.com/SHISHU-HEALTH-GUIDE-KHANNA-VIJAYALAKSHMI-ebook/dp/B0761W7MXJ/ref=sr_1_8?dchild=1&keywords=immunization+book&qid=1589134268&sr=8-8,4
B07M6SCDQ8,"Guia Para Remover Verrugas Sem Cirurgias: Dê Adeus Às Suas Verrugas Sem Se Submeter A Bisturis E Outros Procedimentos Dolorosos - De Forma Natural, Segura, Rápida - Em Casa (Portuguese Edition)",http://www.amazon.com/Guia-Para-Remover-Verrugas-Cirurgias-ebook/dp/B07M6SCDQ8/ref=sr_1_2?dchild=1&keywords=hpv&qid=1588546952&sr=8-2&swrs=64FE954B004C06D411598BC323BDFB52,4
B07M6SFD6V,Adeus HPV: Veja Técnicas E Métodos Totalmente Naturais Para Você Dar Adeus Às Suas Preocupações Com O Vírus do Papiloma Humano E Viver Com Muito Mais Tranquilidade (Portuguese Edition),http://www.amazon.com/Adeus-HPV-Totalmente-Preocupa%C3%A7%C3%B5es-Tranquilidade-ebook/dp/B07M6SFD6V/ref=sr_1_3?dchild=1&keywords=hpv&qid=1588546952&sr=8-3&swrs=64FE954B004C06D411598BC323BDFB52,4
B07CT92VZR,Distroller Special Edition Ksimerito Nerile Neonate Doll TURKIGRIN Lazuki KOLOREENIES Edition in Spanish by,http://www.amazon.com/Distroller-Special-Ksimerito-TURKIGRIN-KOLOREENIES/dp/B07CT92VZR/ref=sr_1_9?dchild=1&keywords=immunization+schedule&qid=1588588703&sr=8-9,4
B088FPRPG7,Jigsaw-Puzzles,http://www.amazon.com/dp/B088FPRPG7/ref=sr_1_4?dchild=1&keywords=autism&qid=1589260857&sr=8-4,4
B088FPR5B1,Jigsaw-Puzzles,http://www.amazon.com/dp/B088FPR5B1/ref=sr_1_5?dchild=1&keywords=autism&qid=1589260857&sr=8-5,4
B088FNV4ZR,Jigsaw-Puzzles,http://www.amazon.com/dp/B088FNV4ZR/ref=sr_1_6?dchild=1&keywords=autism&qid=1589260857&sr=8-6,4
B088FR1TLD,Jigsaw-Puzzles,http://www.amazon.com/dp/B088FR1TLD/ref=sr_1_7?dchild=1&keywords=autism&qid=1589260857&sr=8-7,4
B088FPC6DC,Jigsaw-Puzzles,http://www.amazon.com/dp/B088FPC6DC/ref=sr_1_8?dchild=1&keywords=autism&qid=1589260857&sr=8-8,4
B088FQ8QCZ,Jigsaw-Puzzles,http://www.amazon.com/dp/B088FQ8QCZ/ref=sr_1_9?dchild=1&keywords=autism&qid=1589260857&sr=8-9,4
B088FPSQCC,Jigsaw-Puzzles,http://www.amazon.com/dp/B088FPSQCC/ref=sr_1_10?dchild=1&keywords=autism&qid=1589260857&sr=8-10,4
613151349X,Place actuelle de l'ivermectine en médecine humaine: Utilisation et efficacité (Omn.Univ.Europ.) (French Edition),http://www.amazon.com/Gacel-C%C3%A9line/dp/613151349X/ref=sr_1_6?dchild=1&keywords=rabies+vaccine&qid=1589601636&sr=8-6,4
8484413101,Pulga y el Nigromonje/ Measle and The Wrathmonk (Spanish Edition),http://www.amazon.com/Pulga-Nigromonje-Measle-Wrathmonk-Spanish/dp/8484413101/ref=sr_1_5?dchild=1&keywords=measles&qid=1588394333&sr=8-5,4
B003K15IJE,Merle's Door: Lessons from a Freethinking Dog,http://www.amazon.com/Merles-Door-Lessons-Freethinking-Dog-ebook/dp/B003K15IJE/ref=sr_1_6?dchild=1&keywords=vaccination+book&qid=1588584320&sr=8-6&swrs=FEA4D9FBA814CDADFA61119964D06328,5
B07WHRHPV9,Knowledge resistance: How we avoid insight from others,http://www.amazon.com/Knowledge-resistance-avoid-insight-others-ebook/dp/B07WHRHPV9/ref=sr_1_1?dchild=1&keywords=vaccination+book&qid=1588585117&sr=8-1,5
B086HG4PVH,"How To Shit Around the World, 2nd Edition",http://www.amazon.com/How-Shit-Around-World-2nd-ebook/dp/B086HG4PVH/ref=sr_1_6?dchild=1&keywords=vaccination+book&qid=1588585117&sr=8-6,5
B00CWFKGNM,Lament for Harry,http://www.amazon.com/Lament-Harry-Jennifer-Horne-Roberts-ebook/dp/B00CWFKGNM/ref=sr_1_3?dchild=1&keywords=mmr+and+autism&qid=1588669508&sr=8-3&swrs=C0D01D019C0E73EA9B32EE6E93091813,5
1984826212,Mister Rogers' Neighborhood: A Visual History,http://www.amazon.com/Mister-Rogers-Neighborhood-Visual-History/dp/1984826212/ref=sr_1_6?dchild=1&keywords=mmr+and+autism&qid=1588671388&sr=8-6&swrs=CE407CAA1733204FC3C510551C0B5671,5
B001A4LYN2,There Will Be Blood,http://www.amazon.com/There-Will-Blood-Paul-Dano/dp/B001A4LYN2/ref=sr_1_7?dchild=1&keywords=vaccine+friendly+plan&qid=1589378431&sr=8-7,5
B01NAJ2X3L,The Childhood Years,http://www.amazon.com/Babies-and-Breadwinners/dp/B01NAJ2X3L/ref=sr_1_2?dchild=1&keywords=vaccine+friendly+plan&qid=1589378890&sr=8-2,5
B07945WXRC,Phantom Thread,http://www.amazon.com/Phantom-Thread-Daniel-Day-Lewis/dp/B07945WXRC/ref=sr_1_8?dchild=1&keywords=vaccine+friendly+plan&qid=1589378890&sr=8-8,5
B00BLGXL3U,The Master,http://www.amazon.com/Master-Philip-Seymour-Hoffman/dp/B00BLGXL3U/ref=sr_1_9?dchild=1&keywords=vaccine+friendly+plan&qid=1589378890&sr=8-9,5
1459504348,Flu Shot Fidgets (The Secret Games of Maximus Todd),http://www.amazon.com/Shot-Fidgets-Secret-Games-Maximus/dp/1459504348/ref=sr_1_8?dchild=1&keywords=flu+shot&qid=1589009429&sr=8-8,5
B06XRCP54Z,Mini Button Little Round Penguin - Doctor Surgeon,http://www.amazon.com/Mini-Button-Little-Round-Penguin/dp/B06XRCP54Z/ref=sr_1_1?dchild=1&keywords=flu+shot&qid=1589010609&sr=8-1,5
B06XQJ8GT7,Greeting Card Little Round Penguin - Doctor Surgeon,http://www.amazon.com/Greeting-Card-Little-Round-Penguin/dp/B06XQJ8GT7/ref=sr_1_2?dchild=1&keywords=flu+shot&qid=1589010609&sr=8-2,5
B06XQ3WLHV,Note Card Little Round Penguin - Doctor Surgeon,http://www.amazon.com/Note-Card-Little-Round-Penguin/dp/B06XQ3WLHV/ref=sr_1_3?dchild=1&keywords=flu+shot&qid=1589010609&sr=8-3,5
B06XRT971B,2.25 Inch Button Little Round Penguin - Doctor Surgeon,http://www.amazon.com/2-25-Button-Little-Round-Penguin/dp/B06XRT971B/ref=sr_1_6?dchild=1&keywords=flu+shot&qid=1589010609&sr=8-6,5
B01F1CP0DS,Grace Communion Cups - Box of 1000 - Plastic Disposable Fits Standard Holy Communion Trays,http://www.amazon.com/Grace-Communion-Cups-Disposable-Standard/dp/B01F1CP0DS/ref=sr_1_9?dchild=1&keywords=flu+shot&qid=1589012648&sr=8-9,5
B005A5Z47E,Recreational Trimix Diving,http://www.amazon.com/Recreational-Trimix-Diving-Kevin-Evans-ebook/dp/B005A5Z47E/ref=sr_1_3?dchild=1&keywords=rabies+vaccine&qid=1588824033&sr=8-3,5
B015X6GZIG,HomeAgain 134 kHz 15-Digit Universal WorldChip Microchip (25pk),http://www.amazon.com/HomeAgain-digit-Universal-WorldChip-Microchip/dp/B015X6GZIG/ref=sr_1_6?dchild=1&keywords=rabies+vaccine&qid=1588826420&sr=8-6,5
B07SZ9KPTH,"Louis Pasteur (1822 95) in his Laboratory, 1885"" Black Floating Frame Canvas Art, 26""x32""x1.75""",http://www.amazon.com/Louis-Pasteur-Laboratory-Floating-Canvas/dp/B07SZ9KPTH/ref=sr_1_7?dchild=1&keywords=rabies+vaccine&qid=1588826420&sr=8-7,5
B004E0I0C2,Mister Rogers' Neighborhood 1979-2001,http://www.amazon.com/Episode-14/dp/B004E0I0C2/ref=sr_1_4?dchild=1&keywords=immunization&qid=1588792616&sr=8-4&swrs=538AC16B65E3DC94C200E60BED1352D6,5
B07KFBMY1Q,WALNEW Passport Holder Cover Case Travelling Passport Cards Carrier Wallet Case (E-Pink Bird),http://www.amazon.com/WALNEW-Passport-Holder-Travelling-Carrier/dp/B07KFBMY1Q/ref=sr_1_6?dchild=1&keywords=immunization&qid=1588792616&sr=8-6&swrs=538AC16B65E3DC94C200E60BED1352D6,5
B06XQFDNQQ,"C.R. Gibson 'Sweet as Can Be' Perfect-Bound Memory Book for Newborns and Babies, 64 Pages, 9"" W x 11.125"" H",http://www.amazon.com/C-R-Gibson-Perfect-Bound-Memory-Newborns/dp/B06XQFDNQQ/ref=sr_1_8?dchild=1&keywords=immunization&qid=1588792616&sr=8-8&swrs=538AC16B65E3DC94C200E60BED1352D6,5
B00TKV2OQS,JAM PAPER Plastic Envelopes with Hook & Loop Closure - Index - 5 1/2 x 7 1/2 - Assorted Colors - 6/Pack,http://www.amazon.com/sobres-pl%C3%A1stico-indexar-Colores-Variados/dp/B00TKV2OQS/ref=sr_1_9?dchild=1&keywords=immunization&qid=1588792616&sr=8-9&swrs=538AC16B65E3DC94C200E60BED1352D6,5
1607186268,Ferdinand Fox's First Summer (Arbordale Collection),http://www.amazon.com/Ferdinand-First-Summer-Arbordale-Collection/dp/1607186268/ref=sr_1_5?dchild=1&keywords=gardasil&qid=1588824037&sr=8-5,5
B01M0U8RSR,Gardasil,http://www.amazon.com/dp/B01M0U8RSR/ref=sr_1_7?dchild=1&keywords=gardasil&qid=1588824037&sr=8-7,5
B07RNWF5P7,Analyzing Social Media Networks with NodeXL: Insights from a Connected World,http://www.amazon.com/Analyzing-Social-Media-Networks-NodeXL-ebook/dp/B07RNWF5P7/ref=sr_1_10?dchild=1&keywords=gardasil&qid=1588824984&sr=8-10&swrs=8FD8F81D3F19C95679D6CF69A3AC3E5E,5
B00NYARB8M,Animal Eyes,http://www.amazon.com/Animal-Eyes-Mary-Holland-ebook/dp/B00NYARB8M/ref=sr_1_8?dchild=1&keywords=gardasil&qid=1588825430&sr=8-8,5
B01K5S5IOY,NOFX: The Hepatitis Bathtub and Other Stories,http://www.amazon.com/NOFX-NOFX-Jeff-Alulis-audiobook/dp/B01K5S5IOY/ref=sr_1_1?dchild=1&keywords=hepatitis+a&qid=1589491829&sr=8-1,5
B005OK3HGK,"GIANT MICROBES Hepatitis Plush, 5-7""",http://www.amazon.com/GIANT-MICROBES-Hepatitis-Plush-5-7/dp/B005OK3HGK/ref=sr_1_2?dchild=1&keywords=hepatitis+a&qid=1589491829&sr=8-2,5
B07DQ9TZC8,"Kenmore 53294 Style O HEPA Cloth Vacuum Bags for Kenmore Upright Vacuum Cleaners 6 Pack,White",http://www.amazon.com/Kenmore-53294-Vacuum-Upright-Cleaners/dp/B07DQ9TZC8/ref=sr_1_2?dchild=1&keywords=hepatitis+a&qid=1589495325&sr=8-2,5
B00G0PXU2Y,Inequality For All,http://www.amazon.com/Inequality-All-Robert-Reich/dp/B00G0PXU2Y/ref=sr_1_5?dchild=1&keywords=hepatitis+a&qid=1589495325&sr=8-5,5
B00IEG2UGE,Kenmore 86889 HEPA Filter (4 pack) by envirocare,http://www.amazon.com/EnviroCare-Replacement-Filters-Kenmore-Machines/dp/B00IEG2UGE/ref=sr_1_6?dchild=1&keywords=hepatitis+a&qid=1589495325&sr=8-6,5
B06XCWWLXQ,"Colorfullife 2 Hepa Filter 4 Foam for Shark Vacuum Cleaner Navigator Lift-Away NV350, NV351, NV352, NV355, NV356E, NV357, NV360, NV370, NV391, UV440, UV490, UV540 Part XFF350 XHF350",http://www.amazon.com/Colorfullife-Filter-Cleaner-Navigator-Lift-Away/dp/B06XCWWLXQ/ref=sr_1_7?dchild=1&keywords=hepatitis+a&qid=1589495325&sr=8-7,5
B01HLA4OCQ,"Fette Filter - Pre-Filters Compatible with Dyson Vacuum Filter V6, V7, V8, DC58, DC59 - Compare to Part # 965661-01. (Pack of 4)",http://www.amazon.com/3-Pack-Compatible-Pre-Filter-Replaces-965661-01/dp/B01HLA4OCQ/ref=sr_1_8?dchild=1&keywords=hepatitis+a&qid=1589495325&sr=8-8,5
0557669340,Callous Disregard,http://www.amazon.com/Callous-Disregard-Rex-Elliot-Hall/dp/0557669340/ref=sr_1_5?dchild=1&keywords=andrew+wakefield&qid=1588608030&sr=8-5,5
B078Y34P7F,"Pathological Optimist, The",http://www.amazon.com/Pathological-Optimist-Documentary-Cast/dp/B078Y34P7F/ref=sr_1_10?dchild=1&keywords=andrew+wakefield&qid=1588608030&sr=8-10,5
B00OO7AXPM,Anthony Hardy: The Camden Ripper (True Crimes Series Book 32),http://www.amazon.com/Anthony-Hardy-Camden-Ripper-Crimes-ebook/dp/B00OO7AXPM/ref=sr_1_4?dchild=1&keywords=andrew+wakefield&qid=1588608538&sr=8-4,5
B073X64DSV,Autism in Heels: The Untold Story of a Female Life on the Spectrum,http://www.amazon.com/Autism-Heels-Untold-Female-Spectrum-ebook/dp/B073X64DSV/ref=sr_1_5?dchild=1&keywords=andrew+wakefield&qid=1588608538&sr=8-5,5
B073RHKT64,My Scottish Dom,http://www.amazon.com/My-Scottish-Dom-Alexi-Wakefield-ebook/dp/B073RHKT64/ref=sr_1_6?dchild=1&keywords=andrew+wakefield&qid=1588608538&sr=8-6,5
0900001453,Anna Laetitia Barbauld,http://www.amazon.com/Anna-Laetitia-Barbauld-Dick-Wakefield/dp/0900001453/ref=sr_1_10?dchild=1&keywords=andrew+wakefield&qid=1588608538&sr=8-10,5
B07FZPTDJ3,"Cribsheet: A Data-Driven Guide to Better, More Relaxed Parenting, from Birth to Preschool",http://www.amazon.com/Cribsheet-Data-Driven-Relaxed-Parenting-Preschool-ebook/dp/B07FZPTDJ3/ref=sr_1_8?dchild=1&keywords=andrew+wakefield&qid=1588609011&sr=8-8&swrs=AA89AA38F29552A96451F37136670614,5
0813145643,"Diplomatic Games: Sport, Statecraft, and International Relations since 1945 (Studies In Conflict Diplomacy Peace)",http://www.amazon.com/Diplomatic-Games-Statecraft-International-Relations/dp/0813145643/ref=sr_1_4?dchild=1&keywords=andrew+wakefield&qid=1588609959&sr=8-4,5
B07D18YSSV,Routledge Handbook on Offenders with Special Needs (Routledge International Handbooks),http://www.amazon.com/Routledge-Handbook-Offenders-Special-Needs-ebook/dp/B07D18YSSV/ref=sr_1_6?dchild=1&keywords=andrew+wakefield&qid=1588609959&sr=8-6,5
B07L19YCCG,Social Value in Construction,http://www.amazon.com/Social-Value-Construction-Ani-Raiden-ebook/dp/B07L19YCCG/ref=sr_1_10?dchild=1&keywords=andrew+wakefield&qid=1588609959&sr=8-10,5
0590449486,"Itchy, Itchy Chicken Pox (Hello Reader!, Level 1)",http://www.amazon.com/Itchy-Chicken-Hello-Reader-Level/dp/0590449486/ref=sr_1_3?dchild=1&keywords=chicken+pox&qid=1589565450&sr=8-3,5
0689876106,Goldie Locks Has Chicken Pox,http://www.amazon.com/Goldie-Locks-Has-Chicken-Pox/dp/0689876106/ref=sr_1_5?dchild=1&keywords=chicken+pox&qid=1589565450&sr=8-5,5
0316110507,Arthur's Chicken Pox: An Arthur Adventure (Arthur Adventure Series),http://www.amazon.com/Arthurs-Chicken-Pox-Arthur-Adventure/dp/0316110507/ref=sr_1_6?dchild=1&keywords=chicken+pox&qid=1589565450&sr=8-6,5
B00ED27B44,"You Can't Eat Your Chicken Pox, Amber Brown",http://www.amazon.com/Cant-Your-Chicken-Amber-Brown-ebook/dp/B00ED27B44/ref=sr_1_8?dchild=1&keywords=chicken+pox&qid=1589565450&sr=8-8,5
B06XPGL2CB,Odd Socks and Chicken Pox,http://www.amazon.com/Odd-Socks-Chicken-Steven-Salle-ebook/dp/B06XPGL2CB/ref=sr_1_1?dchild=1&keywords=chicken+pox&qid=1589566897&sr=8-1,5
B07V8FX61Q,Chicken Pox & Me,http://www.amazon.com/Chicken-Pox-Me-Anne-Jensen-ebook/dp/B07V8FX61Q/ref=sr_1_5?dchild=1&keywords=chicken+pox&qid=1589566897&sr=8-5,5
B00997YEAM,The Chicken Pox Panic (Cul-de-Sac Kids Book #2),http://www.amazon.com/Chicken-Panic-Cul-Sac-Kids-ebook/dp/B00997YEAM/ref=sr_1_6?dchild=1&keywords=chicken+pox&qid=1589566897&sr=8-6,5
B01B3DBAK6,Karen's Chicken Pox (Baby-Sitters Little Sister #114),http://www.amazon.com/Karens-Chicken-Baby-Sitters-Little-Sister-ebook/dp/B01B3DBAK6/ref=sr_1_7?dchild=1&keywords=chicken+pox&qid=1589566897&sr=8-7,5
1563970910,How Do We Dream?,http://www.amazon.com/How-Do-Dream-Jack-Myers/dp/1563970910/ref=sr_1_8?dchild=1&keywords=chicken+pox&qid=1589566897&sr=8-8,5
0966237803,Sick Bay,http://www.amazon.com/Sick-Bay-Sharon-Olexa-Crandall/dp/0966237803/ref=sr_1_9?dchild=1&keywords=chicken+pox&qid=1589566897&sr=8-9,5
0064441938,Grandmas at Bat (I Can Read Level 2),http://www.amazon.com/Grandmas-Bat-Can-Read-Level/dp/0064441938/ref=sr_1_10?dchild=1&keywords=chicken+pox&qid=1589566897&sr=8-10,5
0380898217,Sam and Violet's Get Well Book (A Snuggle and Read Story Book),http://www.amazon.com/Violets-Well-Book-Snuggle-Story/dp/0380898217/ref=sr_1_1?dchild=1&keywords=chicken+pox&qid=1589568206&sr=8-1,5
1402720831,I'm Going to Read® (Level 3): When Daddy Had the Chicken Pox (I'm Going to Read® Series),http://www.amazon.com/Lionel-Kalish/dp/1402720831/ref=sr_1_2?dchild=1&keywords=chicken+pox&qid=1589568206&sr=8-2,5
B0084IUDFM,Grandpa Spanielson's Chicken Pox Stories: A Snout for Chocolate (I Can Read Level 2),http://www.amazon.com/Grandpa-Spanielsons-Chicken-Pox-Stories-ebook/dp/B0084IUDFM/ref=sr_1_3?dchild=1&keywords=chicken+pox&qid=1589568206&sr=8-3,5
0807581275,Turkey Pox,http://www.amazon.com/Turkey-Pox-Laurie-Halse-Anderson/dp/0807581275/ref=sr_1_4?dchild=1&keywords=chicken+pox&qid=1589568206&sr=8-4,5
0307263029,"Marsha Makes Me Sick (Step-Into-Reading, Step 3)",http://www.amazon.com/Marsha-Makes-Sick-Step-Into-Reading-Step/dp/0307263029/ref=sr_1_5?dchild=1&keywords=chicken+pox&qid=1589568206&sr=8-5,5
B000VYCZJY,Grandpa Spanielson's Chicken Pox Stories: Story #1: The Octopus (I Can Read Book 2),http://www.amazon.com/Grandpa-Spanielsons-Chicken-Pox-Stories/dp/B000VYCZJY/ref=sr_1_6?dchild=1&keywords=chicken+pox&qid=1589568206&sr=8-6,5
0780760875,"You Can't Eat Your Chicken Pox, Amber Brown (Amber Brown (Pb))",http://www.amazon.com/Cant-Your-Chicken-Amber-Brown/dp/0780760875/ref=sr_1_7?dchild=1&keywords=chicken+pox&qid=1589568206&sr=8-7,5
1683529200,The Day the Principal Got the Chicken Pox,http://www.amazon.com/Elizabeth-Ketter/dp/1683529200/ref=sr_1_8?dchild=1&keywords=chicken+pox&qid=1589568206&sr=8-8,5
0517083221,Betsy & the Chicken Pox (Betsy Books),http://www.amazon.com/Betsy-Chicken-Pox-Books/dp/0517083221/ref=sr_1_9?dchild=1&keywords=chicken+pox&qid=1589568206&sr=8-9,5
B00WKNL6N0,Amber Brown (10 book series) Kindle Edition,http://www.amazon.com/Amber-Brown-10-Book-Series/dp/B00WKNL6N0/ref=sr_1_10?dchild=1&keywords=chicken+pox&qid=1589568206&sr=8-10,5
0590483765,My Tooth Is About to Fall Out (Scholastic Reader Level 1),http://www.amazon.com/Tooth-About-Scholastic-Reader-Level/dp/0590483765/ref=sr_1_2?dchild=1&keywords=chicken+pox&qid=1589569478&sr=8-2,5
B001C4NXMA,"Alvin Ho: Allergic to Girls, School, and Other Scary Things",http://www.amazon.com/Alvin-Ho-Allergic-School-Things-ebook/dp/B001C4NXMA/ref=sr_1_3?dchild=1&keywords=chicken+pox&qid=1589569478&sr=8-3,5
059026267X,"The First Grade Friends: Lunch Box Surprise (Hello Reader, Level 1)",http://www.amazon.com/First-Grade-Friends-Surprise-Reader/dp/059026267X/ref=sr_1_5?dchild=1&keywords=chicken+pox&qid=1589569478&sr=8-5,5
0590259458,"What is That? Said the Cat (Scholastic Hello Reader, Level 1)",http://www.amazon.com/What-Scholastic-Hello-Reader-Level/dp/0590259458/ref=sr_1_7?dchild=1&keywords=chicken+pox&qid=1589569478&sr=8-7,5
1556618042,The Cul-de-sac Kids  Books 1-6 (Boxed Set),http://www.amazon.com/Cul-sac-Kids-Books-Boxed/dp/1556618042/ref=sr_1_8?dchild=1&keywords=chicken+pox&qid=1589569478&sr=8-8,5
B073Z85M3M,Another Way to Climb a Tree,http://www.amazon.com/Another-Climb-Tree-Garton-Scanlon-ebook/dp/B073Z85M3M/ref=sr_1_9?dchild=1&keywords=chicken+pox&qid=1589569478&sr=8-9,5
141696861X,Red Zone (Barber Game Time Books),http://www.amazon.com/Tiki-Barber/dp/141696861X/ref=sr_1_10?dchild=1&keywords=chicken+pox&qid=1589569478&sr=8-10,5
B07Z281L4P,The Chicken Pox Capers,http://www.amazon.com/Chicken-Pox-Capers-Joanne-Oemig-ebook/dp/B07Z281L4P/ref=sr_1_1?dchild=1&keywords=chicken+pox&qid=1589570791&sr=8-1,5
B010OQSKG0,Princess Mirror-Belle and the Dragon Pox,http://www.amazon.com/Princess-Mirror-Belle-Dragon-Pox/dp/B010OQSKG0/ref=sr_1_3?dchild=1&keywords=chicken+pox&qid=1589570791&sr=8-3,5
1983576573,"An ""Awful"" Beautiful Day: (or...  Me and My CHICKEN POX!)",http://www.amazon.com/Awful-Beautiful-Day-CHICKEN-POX/dp/1983576573/ref=sr_1_5?dchild=1&keywords=chicken+pox&qid=1589570791&sr=8-5,5
B06WVJ8KFQ,"Mga Kwento ni Tito Dok 13: Yakkk, Bulutong-Tubig!",http://www.amazon.com/Mga-Kwento-Tito-Dok-Bulutong-Tubig-ebook/dp/B06WVJ8KFQ/ref=sr_1_10?dchild=1&keywords=chicken+pox&qid=1589570791&sr=8-10,5
B081P93CVV,Historic Images - 1978 Press Photo Naomi Elmore gets-Hepatitis Vaccine-Nazarene Christian Day Care,http://www.amazon.com/Historic-Images-gets-Hepatitis-Vaccine-Nazarene-Christian/dp/B081P93CVV/ref=sr_1_7?dchild=1&keywords=hepatitis+vaccine&qid=1588637614&sr=8-7&swrs=CB4F9EA097429568B217C1CCE756ADDF,5
B002JCAFH0,SID THE SCIENCE KID Talkin' Sid,http://www.amazon.com/SID-SCIENCE-KID-Talkin-Sid/dp/B002JCAFH0/ref=sr_1_4?dchild=1&keywords=flu+shot&qid=1589443867&sr=8-4,5
B088FDZ2NB,5D DIY Diamond Painting Kits Sick Dog Full Drill Painting Arts Craft Canvas for Home Wall Decor Full Drill Cross Stitch Gift 14X20 Inch,http://www.amazon.com/Diamond-Painting-Drill-Canvas-Stitch/dp/B088FDZ2NB/ref=sr_1_6?dchild=1&keywords=flu+shot&qid=1589445896&sr=8-6,5
B083XGW1WP,Infinite Memories Sterling Silver Love Heart Infinity Monogram Customized Any Name Necklace Gift for Christmas,http://www.amazon.com/Infinite-Memories-Infinity-Horseshoe-Personalized/dp/B083XGW1WP/ref=sr_1_8?dchild=1&keywords=wakefield+autism&qid=1589550971&sr=8-8,5
B0823XNKPQ,LoEnMe Jewelry Capricorn Sterling Silver Custom Made Personalized 12 Constellations Name Necklace Best Gift,http://www.amazon.com/LoEnMe-Jewelry-Capricorn-Personalized-Sunflower/dp/B0823XNKPQ/ref=sr_1_9?dchild=1&keywords=wakefield+autism&qid=1589550971&sr=8-9,5
B081VHYGH8,LoEnMe Jewelry Aquarius Sterling Silver Custom Made Personalized 12 Constellations Name Necklace Best Gift,http://www.amazon.com/LoEnMe-Jewelry-Aquarius-Personalized-Sunflower/dp/B081VHYGH8/ref=sr_1_10?dchild=1&keywords=wakefield+autism&qid=1589550971&sr=8-10,5
B06WPB59TM,The Marvelous Mrs. Maisel,http://www.amazon.com/Pilot/dp/B06WPB59TM/ref=sr_1_1?dchild=1&keywords=mmr&qid=1588780830&sr=8-1,5
B07KBD2L64,MMR Mold Killer and Mold/Mildew Stain Remover Combo Pack-1 Gallon Instant Mold/Mildew Stain Remover and 2 oz. Concentrate (Makes 1 gal.) Mold/Mildew Disinfectant,http://www.amazon.com/Killer-Remover-Instant-Concentrate-Disinfectant/dp/B07KBD2L64/ref=sr_1_2?dchild=1&keywords=mmr&qid=1588780830&sr=8-2,5
B07N6FY9G1,Professional 1-gal. Instant Mold and Mildew Stain Remover (4-Pack),http://www.amazon.com/Professional-1-gal-Instant-Mold-Remover/dp/B07N6FY9G1/ref=sr_1_3?dchild=1&keywords=mmr&qid=1588780830&sr=8-3,5
B07N32SLD8,MMR Pro Mold Killer and Mold/Mildew Stain Remover Combo Pack-32 oz. Instant Mold/Mildew Stain Remover and 2 oz. Concentrate (Makes 1 gal.) Mold/Mildew Disinfectant,http://www.amazon.com/MMR-Mold-Remover-Concentrate-Disinfectant/dp/B07N32SLD8/ref=sr_1_4?dchild=1&keywords=mmr&qid=1588780830&sr=8-4,5
B07G9PHJJH,The Marvelous Mrs. Maisel,http://www.amazon.com/Lets-Face-Music-Dance/dp/B07G9PHJJH/ref=sr_1_5?dchild=1&keywords=mmr&qid=1588780830&sr=8-5,5
B01H4KXMU8,Mr. Robot,http://www.amazon.com/eps2-0_unm4sk-pt1-tc/dp/B01H4KXMU8/ref=sr_1_6?dchild=1&keywords=mmr&qid=1588780830&sr=8-6,5
B07WSD8XWF,The Marvelous Mrs. Maisel,http://www.amazon.com/Strike-Up-the-Band/dp/B07WSD8XWF/ref=sr_1_7?dchild=1&keywords=mmr&qid=1588780830&sr=8-7,5
B07WTWYY5N,Professional 1-gal. and 32oz. Combo Instant Mold and Mildew Stain Remover,http://www.amazon.com/Professional-1-gal-Instant-Mold-Remover/dp/B07WTWYY5N/ref=sr_1_8?dchild=1&keywords=mmr&qid=1588780830&sr=8-8,5
B07N49JJDC,MMR Pro Mold Killer and Mold/Mildew Stain Remover Combo Pack-(4)1 Gallon Instant Mold/Mildew Stain Remover and (4)2 oz. Concentrate (Makes 1 gal.) Mold/Mildew Disinfectant …,http://www.amazon.com/Killer-Remover-Instant-Concentrate-Disinfectant/dp/B07N49JJDC/ref=sr_1_9?dchild=1&keywords=mmr&qid=1588780830&sr=8-9,5
B07FP11SZN,Homecoming,http://www.amazon.com/Work/dp/B07FP11SZN/ref=sr_1_10?dchild=1&keywords=mmr&qid=1588780830&sr=8-10,5
B00DHWMPI8,Daniel Tiger's Neighborhood,http://www.amazon.com/Something-Special-Dad-Love-You/dp/B00DHWMPI8/ref=sr_1_1?dchild=1&keywords=mmr&qid=1588781186&sr=8-1,5
B07G9LGZCM,The Marvelous Mrs. Maisel,http://www.amazon.com/Mid-way-to-Mid-town/dp/B07G9LGZCM/ref=sr_1_2?dchild=1&keywords=mmr&qid=1588781186&sr=8-2,5
B0821XGVMP,The Marvelous Mrs. Maisel (4K UHD),http://www.amazon.com/Marvelous-Radio/dp/B0821XGVMP/ref=sr_1_4?dchild=1&keywords=mmr&qid=1588781186&sr=8-4,5
