url_code,title,url,annotation
B00EFRV7Y2,"Cold Cough & Flu, Mucinex Fast-Max Day Time Severe Cold & Night Time Cold & Flu Liquid 12oz(2x6oz) Relieves Headache, Fever, Nasal & Chest Congestion, Controls Cough, Thins & Loosens Mucus",http://www.amazon.com/gp/slredirect/picassoRedirect.html/ref=pa_sp_atf_aps_sr_pg1_2?ie=UTF8&adId=A06088872QVBXXQAAJXSA&url=%2FMucinex-Fast-Max-Double-Severe-Night%2Fdp%2FB00EFRV7Y2%2Fref%3Dsr_1_2_sspa%3Fdchild%3D1%26keywords%3Dflu%26qid%3D1589177136%26sr%3D8-2-spons%26psc%3D1&qualifier=1589177136&id=438822029949144&widgetName=sp_atf,0
B0078W0QOI,Boiron Oscillococcinum 30 Doses Homeopathic Medicine for Flu-Like Symptoms,http://www.amazon.com/ABO-098-Flu-like-Symptoms-Oscillococcinum/dp/B0078W0QOI/ref=sr_1_6?dchild=1&keywords=flu&qid=1589177136&sr=8-6,0
B000OCXFWE,The Great Influenza: The Story of the Deadliest Pandemic in History,http://www.amazon.com/Great-Influenza-Deadliest-Pandemic-History-ebook/dp/B000OCXFWE/ref=sr_1_8?dchild=1&keywords=flu&qid=1589177136&sr=8-8,0
B084DBP1QC,The Coming Pandemic,http://www.amazon.com/Coming-Pandemic-Ross-Coulthart/dp/B084DBP1QC/ref=sr_1_3?dchild=1&keywords=flu&qid=1589177667&sr=8-3,0
B07M7BDYWQ,BBC - Return of the Black Death,http://www.amazon.com/Return-Black-Death-Kenny-Scott/dp/B07M7BDYWQ/ref=sr_1_4?dchild=1&keywords=flu&qid=1589177667&sr=8-4,0
B01K0Z75PW,Virus Empire: From SARS to Ebola,http://www.amazon.com/Virus-Empire-Ebola-Petra-H%C3%B6fer/dp/B01K0Z75PW/ref=sr_1_6?dchild=1&keywords=flu&qid=1589177667&sr=8-6,0
B084CT81RW,The Coming Pandemic,http://www.amazon.com/Coming-Pandemic-Ross-Coulthart/dp/B084CT81RW/ref=sr_1_1?dchild=1&keywords=flu&qid=1589178056&sr=8-1,0
0553386697,The Whole-Brain Child: 12 Revolutionary Strategies to Nurture Your Child's Developing Mind,http://www.amazon.com/dp/0553386697/ref=sr_1_5?dchild=1&keywords=vaccine+free+me&qid=1588944633&sr=8-5,0
B07DRTJPY8,The Moth in the Iron Lung: A Biography of Polio,http://www.amazon.com/Moth-Iron-Lung-Biography-Polio/dp/B07DRTJPY8/ref=sr_1_3?dchild=1&keywords=anti+vaccination&qid=1588395716&sr=8-3&swrs=686F5510D1A34B7960F5C55E5AA2A275,1
B07Q5CDBY3,"Special Supplies 30-Pack Fun Pull and Pop Tubes for Kids Stretch, Bend, Build, and Connect Toy, Provide Tactile and Auditory Sensory Play, Colorful, Heavy-Duty Plastic",http://www.amazon.com/Special-Supplies-Auditory-Colorful-Heavy-Duty/dp/B07Q5CDBY3/ref=sr_1_8?dchild=1&keywords=autism&qid=1588395501&sr=8-8&swrs=A74BF4E371C23604881347A385070CA6,0
B085KXWR21,"ZaxiDeel Sensory Toys for Autistic Children and Adults, 23 Pack Fidget Toys - Pop Tubes, Bean Bags, Giant Stress Ball, Squeeze Ball, Spiky Sensory Balls and Stretchy Strings Set",http://www.amazon.com/ZaxiDeel-Sensory-Autistic-Children-Adults/dp/B085KXWR21/ref=sr_1_2?dchild=1&keywords=autism&qid=1588396871&sr=8-2&swrs=93284E2F0A3B1E5D84156DF1CE0B3A73,0
B086DLRJB6,"VRCLUB Squishy Stress Balls Toy, Squeezing Stress Relief Ball (4-Pack) for Kids and Adults, Colorful Funny Fidget Sensory Toys for Anxiety, ADHD, Bad Habits and More",http://www.amazon.com/VRCLUB-Squishy-Squeezing-Colorful-Sensory/dp/B086DLRJB6/ref=sr_1_3?dchild=1&keywords=autism&qid=1588396871&sr=8-3&swrs=93284E2F0A3B1E5D84156DF1CE0B3A73,0
B087Z9NM14,"Curious Minds Busy Bags Set of 4 Soft Fluff- Filled Spiky Knobby Squeeze Stress Balls - Sensory, Stress, Fidget Toy Super Soft Doggy OT",http://www.amazon.com/dp/B087Z9NM14/ref=sr_1_4?dchild=1&keywords=autism&qid=1588396871&sr=8-4&swrs=93284E2F0A3B1E5D84156DF1CE0B3A73,0
B00H5A7W1S,Immunization Card Set,http://www.amazon.com/MDpocket-Immunization-Card-Set/dp/B00H5A7W1S/ref=sr_1_1?dchild=1&keywords=immunization+schedule&qid=1589013931&sr=8-1,0
1795790326,"Pet Health Record: Dog Vaccination and Shot Record Note Book, Complete Puppy and Dog Immunization Schedule and Record with Labrador Retriever Design Cover",http://www.amazon.com/Pet-Health-Record-Vaccination-Immunization/dp/1795790326/ref=sr_1_2?dchild=1&keywords=immunization+schedule&qid=1589013931&sr=8-2,0
1795790679,"Pet Health Record: Dog Vaccination and Shot Record Note Book, Complete Puppy and Dog Immunization Schedule and Record with Bulldog Design Cover",http://www.amazon.com/Pet-Health-Record-Vaccination-Immunization/dp/1795790679/ref=sr_1_6?dchild=1&keywords=immunization+schedule&qid=1589013931&sr=8-6,0
B017USF1U8,Medical Abbreviations Guide - Pocket Chart - Medical Quick Reference Guide by Permacharts,http://www.amazon.com/Medical-Abbreviations-Guide-Reference-Permacharts/dp/B017USF1U8/ref=sr_1_8?dchild=1&keywords=immunization+schedule&qid=1589015193&sr=8-8,0
B017USGVQQ,"Pediatric Care Guide I - 4.5"" x 6.75"" Laminated Medical Pocket Quick Reference Guide by Permacharts",http://www.amazon.com/Pediatric-Care-Guide-Laminated-Permacharts/dp/B017USGVQQ/ref=sr_1_9?dchild=1&keywords=immunization+schedule&qid=1589015193&sr=8-9,0
B017USEP82,"Lymphatic System Guide - Laminated 4.5"" x 6.75"" Pocket Chart - Medical Quick Reference Guide by Permacharts",http://www.amazon.com/Lymphatic-System-Guide-Laminated-Permacharts/dp/B017USEP82/ref=sr_1_10?dchild=1&keywords=immunization+schedule&qid=1589015193&sr=8-10,0
B01DV758YQ,Maternal & Child Nursing Care,http://www.amazon.com/Maternal-Child-Nursing-Marcia-London-ebook/dp/B01DV758YQ/ref=sr_1_1?dchild=1&keywords=immunization+schedule&qid=1589016289&sr=8-1,0
B07MDT2BH4,"Medical Notes with Medical Abbrev Booklet - 67 Medical Reference Cards (3.5"" x 5"" Cards) for Internal Medicine, Surgery, Anesthesia, OBGYN, Pediatrics, Neurology, and Psychiatry",http://www.amazon.com/Medical-Notes-Abbrev-Booklet-Anesthesia/dp/B07MDT2BH4/ref=sr_1_5?dchild=1&keywords=immunization+schedule&qid=1589016289&sr=8-5,0
B00GNOIVW6,"BookFactory Childhood Immunization Schedule Log Book/Journal/Logbook - 120 Page, 8.5""x11"", Black Hardbound (XLog-120-7CS-A-L-Black(Childhood Immunization Schedule Log Book))",http://www.amazon.com/BookFactory-Childhood-Immunization-Schedule-XLog-120-7CS/dp/B00GNOIVW6/ref=sr_1_7?dchild=1&keywords=immunization+schedule&qid=1589016289&sr=8-7,0
B00CR6CIFK,Complete Nurse RN CNA NA Horizontal Badge Card Set - 13 Cards,http://www.amazon.com/Complete-Nurse-Horizontal-Badge-Card/dp/B00CR6CIFK/ref=sr_1_8?dchild=1&keywords=immunization+schedule&qid=1589016289&sr=8-8,0
B07C25WFT6,UniKeep Medical Records Journal (Red/White),http://www.amazon.com/Medical-Records-Journal-Red-White/dp/B07C25WFT6/ref=sr_1_10?dchild=1&keywords=immunization+schedule&qid=1589016289&sr=8-10,0
B0172A1HZM,Mini Nurse Vertical Badge Card Set - 6 Cards,http://www.amazon.com/Mini-Nurse-Vertical-Badge-Card/dp/B0172A1HZM/ref=sr_1_8?dchild=1&keywords=immunization+schedule&qid=1589017464&sr=8-8,0
B0172AHJKY,Mini Nurse Horizontal Badge Card Set - 6 Cards,http://www.amazon.com/Mini-Nurse-Horizontal-Badge-Card/dp/B0172AHJKY/ref=sr_1_9?dchild=1&keywords=immunization+schedule&qid=1589017464&sr=8-9,0
B07V321MN5,"Lisol EKG Badge Card, Cardiac Badge Buddy ECG Rate Cards, Telemetry Card with EKG Ruler/Rhythm/Interpretation/Measurement, Double Sided Pocket Cards Set of 3 for Nurse, Health Care Workers",http://www.amazon.com/Lisol-EKG-Badge-Card/dp/B07V321MN5/ref=sr_1_10?dchild=1&keywords=immunization+schedule&qid=1589017464&sr=8-10,0
B088B9YV2S,"Dog Tracker Journal: Owner's Journal Log Book To Train Your Pet, Keep Records & Notes about your pup",http://www.amazon.com/dp/B088B9YV2S/ref=sr_1_1?dchild=1&keywords=immunization+schedule&qid=1589018617&sr=8-1,0
B088B82J93,"Dog Training Log Book: Owner's Journal Log Book To Train Your Pet, Keep Records & Notes about your pup",http://www.amazon.com/dp/B088B82J93/ref=sr_1_2?dchild=1&keywords=immunization+schedule&qid=1589018617&sr=8-2,0
B088B5X3WQ,"Dog Journal Log Book: Owner's Journal Log Book To Train Your Pet, Keep Records & Notes about your pup",http://www.amazon.com/dp/B088B5X3WQ/ref=sr_1_3?dchild=1&keywords=immunization+schedule&qid=1589018617&sr=8-3,0
B088B4PVND,"Puppy Journal: Owner's Journal Log Book To Train Your Pet, Keep Records & Notes about your pup",http://www.amazon.com/dp/B088B4PVND/ref=sr_1_4?dchild=1&keywords=immunization+schedule&qid=1589018617&sr=8-4,0
B088B24JT7,"Puppy Training Book: Owner's Journal Log Book To Train Your Pet, Keep Records & Notes about your pup",http://www.amazon.com/dp/B088B24JT7/ref=sr_1_5?dchild=1&keywords=immunization+schedule&qid=1589018617&sr=8-5,0
B088B8MF3J,Baby Tracker: Floral Eat Sleep Poop Baby Activity Journal,http://www.amazon.com/dp/B088B8MF3J/ref=sr_1_6?dchild=1&keywords=immunization+schedule&qid=1589018617&sr=8-6,0
B087RGBT35,My Bulldog's Pet Record Organizer: Vet Information Daily Care Health and Vaccine Chart 6x9 100 pages,http://www.amazon.com/Bulldogs-Pet-Record-Organizer-Information/dp/B087RGBT35/ref=sr_1_8?dchild=1&keywords=immunization+schedule&qid=1589018617&sr=8-8,0
B087HDVR9X,Baby Logbook: A Tracker for A Parent or A Nanny To Record Breastfeeding Sleep and Diaper Changes of Your Newborn,http://www.amazon.com/Baby-Logbook-Tracker-Breastfeeding-Changes/dp/B087HDVR9X/ref=sr_1_9?dchild=1&keywords=immunization+schedule&qid=1589018617&sr=8-9,0
B087HBQ2PS,Baby Logbook: Record Breastfeeding Sleep Cycle and Diaper Changes of Your Newborn,http://www.amazon.com/Baby-Logbook-Breastfeeding-Changes-Newborn/dp/B087HBQ2PS/ref=sr_1_10?dchild=1&keywords=immunization+schedule&qid=1589018617&sr=8-10,0
B008DBRDH6,"Febreze Extra Strength Pet Odor Eliminator Room & Carpet  Deodorizing Powder Endorsed by BISSELL, 32 ounces",http://www.amazon.com/Febreze-Strength-Eliminator-Deodorizing-Endorsed/dp/B008DBRDH6/ref=sr_1_4?dchild=1&keywords=varicella+vaccine&qid=1589257016&sr=8-4,0
B085MRRQ3W,Defective T Memory Cell Differentiation after Varicella Zoster Vaccination in Older Individuals,http://www.amazon.com/Defective-Differentiation-Varicella-Vaccination-Individuals-ebook/dp/B085MRRQ3W/ref=sr_1_5?dchild=1&keywords=varicella+vaccine&qid=1589257016&sr=8-5,0
B07G5DW79P,"Picot Sal de Uvas, Effervescent, Anti-acid, Against Heartburn and Indigestion, Fast and Effective, Upset Stomach Relief. 12 Counts. ( Pack of 6)",http://www.amazon.com/Picot-Sal-Uvas-Anti%C3%A1cido-Ct/dp/B07G5DW79P/ref=sr_1_10?dchild=1&keywords=varicella+vaccine&qid=1589257016&sr=8-10,0
0691116237,Hepatitis B,http://www.amazon.com/Hepatitis-B-Hunt-Killer-Virus/dp/0691116237/ref=sr_1_5?dchild=1&keywords=hepatitis+b+vaccine&qid=1589272834&sr=8-5,0
B08627L3YX,Hepatitis C Virus Hypervariable Region 1 Variants Presented on Hepatitis B Virus Capsid-Like Particles Induce Cross-Neutralizing Antibodies,http://www.amazon.com/Hepatitis-Hypervariable-Capsid-Like-Cross-Neutralizing-Antibodies-ebook/dp/B08627L3YX/ref=sr_1_5?dchild=1&keywords=hepatitis+b+vaccine&qid=1589274017&sr=8-5,0
B00FB4NHPK,"Anti-Idiotypes, Receptors, and Molecular Mimicry",http://www.amazon.com/Anti-Idiotypes-Receptors-Molecular-Mimicry-Linthicum-ebook/dp/B00FB4NHPK/ref=sr_1_7?dchild=1&keywords=hepatitis+b+vaccine&qid=1589274017&sr=8-7,0
0824770463,"Viral Hepatitis: Second International Max V. Pettenkofer Symposium (Infectious Diseases and Antimicrobial Agents, 4)",http://www.amazon.com/Viral-Hepatitis-International-Pettenkofer-Antimicrobial/dp/0824770463/ref=sr_1_8?dchild=1&keywords=hepatitis+b+vaccine&qid=1589274017&sr=8-8,0
1910190799,"DNA Tumour Viruses: Virology, Pathogenesis and Vaccines",http://www.amazon.com/DNA-Tumour-Viruses-Virology-Pathogenesis/dp/1910190799/ref=sr_1_4?dchild=1&keywords=hepatitis+b+vaccine&qid=1589275167&sr=8-4,0
3540214941,Coronavirus Replication and Reverse Genetics (Current Topics in Microbiology and Immunology),http://www.amazon.com/Coronavirus-Replication-Genetics-Microbiology-Immunology/dp/3540214941/ref=sr_1_5?dchild=1&keywords=hepatitis+b+vaccine&qid=1589275167&sr=8-5,0
B01MDLVS2Z,Hepatitis E Virus (Advances in Experimental Medicine and Biology Book 948),http://www.amazon.com/Hepatitis-Advances-Experimental-Medicine-Biology-ebook/dp/B01MDLVS2Z/ref=sr_1_6?dchild=1&keywords=hepatitis+b+vaccine&qid=1589275167&sr=8-6,0
B00A5X94HM,Travel Medicine E-Book: Expert Consult - Online and Print,http://www.amazon.com/Travel-Medicine-Book-Jay-Keystone-ebook/dp/B00A5X94HM/ref=sr_1_7?dchild=1&keywords=hepatitis+b+vaccine&qid=1589275167&sr=8-7,0
0898386969,Molecular Components of Hepatitis B Virus (Developments in Molecular Virology),http://www.amazon.com/Molecular-Components-Hepatitis-Developments-Virology/dp/0898386969/ref=sr_1_9?dchild=1&keywords=hepatitis+b+vaccine&qid=1589275167&sr=8-9,0
B00ZQ1SNJ8,Nonviral Vectors for Gene Therapy: Physical Methods and Medical Translation (ISSN Book 89),http://www.amazon.com/Nonviral-Vectors-Gene-Therapy-Translation-ebook/dp/B00ZQ1SNJ8/ref=sr_1_10?dchild=1&keywords=hepatitis+b+vaccine&qid=1589275167&sr=8-10,0
1416026134,The Travel and Tropical Medicine Manual,http://www.amazon.com/Travel-Tropical-Medicine-Manual/dp/1416026134/ref=sr_1_3?dchild=1&keywords=hepatitis+b+vaccine&qid=1589276345&sr=8-3,0
B01M4PBC34,Hepatitis C Virus II: Infection and Disease,http://www.amazon.com/Hepatitis-Virus-II-Infection-Disease-ebook/dp/B01M4PBC34/ref=sr_1_10?dchild=1&keywords=hepatitis+b+vaccine&qid=1589277511&sr=8-10,0
B005ZQP478,"Vicks DayQuil Cold and Flu Multi-Symptom Relief, 48 LiquiCaps (Non-Drowsy) - Sore Throat, Fever, and Congestion Relief",http://www.amazon.com/gp/slredirect/picassoRedirect.html/ref=pa_sp_atf_aps_sr_pg1_2?ie=UTF8&adId=A01884299T5XB0RMBEK4&url=%2FVicks-DayQuil-Multi-Symptom-Relief-LiquiCaps%2Fdp%2FB005ZQP478%2Fref%3Dsr_1_2_sspa%3Fdchild%3D1%26keywords%3Dflu%26qid%3D1589436466%26sr%3D8-2-spons%26psc%3D1&qualifier=1589436466&id=8574188612354089&widgetName=sp_atf,0
B01K0Z8RE0,Virus Empire: From SARS to Ebola,http://www.amazon.com/Petra-H%C3%B6fer/dp/B01K0Z8RE0/ref=sr_1_6?dchild=1&keywords=flu&qid=1589437151&sr=8-6,0
B01I679AMW,Influenza of 1918 (Special Edition),http://www.amazon.com/Influenza-1918-Special-John-Jones/dp/B01I679AMW/ref=sr_1_2?dchild=1&keywords=vaccine+controversy&qid=1589630932&sr=8-2,0
B07L8P9KPX,The SurvivorNet Guide: Immunotherapy,http://www.amazon.com/Immunotherapy-Vaccine-Late-Stage-Prostate-Cancer/dp/B07L8P9KPX/ref=sr_1_4?dchild=1&keywords=vaccine+controversy&qid=1589630932&sr=8-4,0
B01AT28FS2,Forgotten Plague,http://www.amazon.com/Forgotten-Plague-Ron-Davis/dp/B01AT28FS2/ref=sr_1_9?dchild=1&keywords=vaccine+controversy&qid=1589630932&sr=8-9,0
B000HHLWPI,Ivermectin Paste Dewormer - 6.08g dose @ 1.87% Apple Flavor,http://www.amazon.com/Ivermectin-Paste-Dewormer-6-08g-Flavor/dp/B000HHLWPI/ref=sr_1_8?dchild=1&keywords=rabies+vaccine&qid=1589262227&sr=8-8,0
B088FHBMJS,"AA goldfishs Jumps upds from an Aquarium on a Dark -,Unisex Sports Cover anas for Dust, Outdoors, Festivals, Sports Cover",http://www.amazon.com/dp/B088FHBMJS/ref=sr_1_6?dchild=1&keywords=rabies+vaccine&qid=1589266960&sr=8-6,0
B088FFTJG6,"British cat at Home,Unisex Sports Cover anas for Dust, Outdoors, Festivals, Sports Cover",http://www.amazon.com/dp/B088FFTJG6/ref=sr_1_7?dchild=1&keywords=rabies+vaccine&qid=1589266960&sr=8-7,0
B088FF5JGC,"SUNEKING Unisex Sports Cover anas for Dust, Outdoors, Festivals, Sports Cover",http://www.amazon.com/dp/B088FF5JGC/ref=sr_1_8?dchild=1&keywords=rabies+vaccine&qid=1589266960&sr=8-8,0
B088DTZC2P,got rabie? - Men's Ultra Soft Hoodie Sweatshirt,http://www.amazon.com/got-rabie-Hoodie-Sweatshirt-Medium/dp/B088DTZC2P/ref=sr_1_10?dchild=1&keywords=rabies+vaccine&qid=1589266960&sr=8-10,0
B009EC3SH2,STERILOX TECHNOLOGIES 2000-0018 10% DOSING System,http://www.amazon.com/STERILOX-TECHNOLOGIES-2000-0018-DOSING-SYSTEM/dp/B009EC3SH2/ref=sr_1_1?dchild=1&keywords=hpv+vaccine+on+trial&qid=1589118785&sr=8-1,0
B07SRDJ4XY,Inr Wellness MD - Ultra-Pure Beta-Glucan | Dietary Supplement with PURACERE (VCx) for Immune Support | 508mg (240 Caps),http://www.amazon.com/Inr-Wellness-MD-Ultra-Pure-Beta-Glucan/dp/B07SRDJ4XY/ref=sr_1_2?dchild=1&keywords=hpv+vaccine+on+trial&qid=1589118785&sr=8-2,0
B077VW322K,DigestaCure AUTOIMMUNE-X Advanced Formula: Concentrated Immune Modulating Components. All Natural. 270 Capsules.,http://www.amazon.com/DigestaCure-AUTOIMMUNE-X-C%C3%A1psulas-1/dp/B077VW322K/ref=sr_1_3?dchild=1&keywords=hpv+vaccine+on+trial&qid=1589118785&sr=8-3,0
B0855D2Z9S,"Eternus - Cell Energy for Optimized Aging & Long-Term Health | NAD Supplement with Niacinamide, Resveratrol, Vitamin B3, Niacin for NAD+Support (2x40 Capsules)",http://www.amazon.com/Eternus-Optimized-Supplement-Niacinamide-Resveratrol/dp/B0855D2Z9S/ref=sr_1_5?dchild=1&keywords=hpv+vaccine+on+trial&qid=1589118785&sr=8-5,0
B07BT521CQ,Vitamin B12 Deficiency Home Testing Kit for Low Immunity & Fatigue | Accurate Testing | Results in Days | by Lets Get Checked,http://www.amazon.com/LetsGetChecked-at-Home-Vitamin-B12-Test/dp/B07BT521CQ/ref=sr_1_7?dchild=1&keywords=hpv+vaccine+on+trial&qid=1589118785&sr=8-7,0
B07TQKX6N9,"HPD Rx ONE High Potency Multivitamin Supplement, Natural Immune System Support Naturally Respond to HPV for Men and Women – 180 Veggie Capsules",http://www.amazon.com/HPD-Rx-Potency-Multivitamin-Supplement/dp/B07TQKX6N9/ref=sr_1_8?dchild=1&keywords=hpv+vaccine+on+trial&qid=1589118785&sr=8-8,0
B0869R9JRC,Vaccine-preventable diseases - Annual epidemiological report 2014 [2012 data],http://www.amazon.com/Vaccine-preventable-diseases-Annual-epidemiological-report-ebook/dp/B0869R9JRC/ref=sr_1_2?dchild=1&keywords=measles+vaccine&qid=1589566820&sr=8-2,0
B0863TF9GG,"Pet Health Record - DAILY PET Journal - PET Expenses Journal - PET Vaccination Chart: A House is Not a Home, Without a Pet.",http://www.amazon.com/Pet-Health-Record-Expenses-Vaccination/dp/B0863TF9GG/ref=sr_1_4?dchild=1&keywords=vaccination+is+not+immunization&qid=1589364554&sr=8-4,0
B07XVFQX8Z,Tracy Gifts #Immunities - Hashtag Beanie Skull Cap with Fleece Liner,http://www.amazon.com/Tracy-Gifts-Immunities-Hashtag-Beanie/dp/B07XVFQX8Z/ref=sr_1_10?dchild=1&keywords=vaccination+is+not+immunization&qid=1589364554&sr=8-10,0
B07VD2JV9W,#immunities - Adult Men's Hashtag Flexfit Baseball Hat Cap,http://www.amazon.com/Immunities-Hashtag-Flexfit-Baseball-Medium/dp/B07VD2JV9W/ref=sr_1_4?dchild=1&keywords=vaccination+is+not+immunization&qid=1589366019&sr=8-4,0
B07W6X1RTY,Brain Health from Birth: Nurturing Brain Development During Pregnancy and the First Year,http://www.amazon.com/Brain-Health-Birth-Nurturing-Development-ebook/dp/B07W6X1RTY/ref=sr_1_10?dchild=1&keywords=vaccine+friendly+plan&qid=1588602348&sr=8-10&swrs=83041FCA0257293877FA170BF7924A8B,0
1092309632,"Welcome to | My Child's Health Record Book: Baby Health Log, Medical Journal, immunization record, Vaccine Record Log",http://www.amazon.com/Welcome-Childs-Health-Record-Book/dp/1092309632/ref=sr_1_7?dchild=1&keywords=immunization+record&qid=1589289634&sr=8-7,0
B01BKTB7T2,Pet Kennels X-Large,http://www.amazon.com/SportPet-Designs-Plastic-Kennels-Approved/dp/B01BKTB7T2/ref=sr_1_4?dchild=1&keywords=immunization+record&qid=1589292052&sr=8-4,0
0826151078,The APRN’s Complete Guide to Prescribing Pediatric Drug Therapy 2019,http://www.amazon.com/APRNs-Complete-Prescribing-Pediatric-Therapy/dp/0826151078/ref=sr_1_6?dchild=1&keywords=immunization+record&qid=1589292052&sr=8-6,0
B01C7JGIYI,SportPet Designs Pet Kennels Large,http://www.amazon.com/SportPet-Designs-Pet-Kennels-Large/dp/B01C7JGIYI/ref=sr_1_7?dchild=1&keywords=immunization+record&qid=1589292052&sr=8-7,0
B01BLS0TVE,Pet Kennels Small,http://www.amazon.com/SportPet-Designs-CM-2000-CS01-Kennels-Small/dp/B01BLS0TVE/ref=sr_1_8?dchild=1&keywords=immunization+record&qid=1589292052&sr=8-8,0
B01CIR8BXK,Pet Kennels Medium,http://www.amazon.com/SportPet-Designs-Plastic-Kennels-Approved/dp/B01CIR8BXK/ref=sr_1_9?dchild=1&keywords=immunization+record&qid=1589292052&sr=8-9,0
B07JYBYMGN,"Baby Tracker Journal for Newborns (Boy Edition) - Baby Diary, Daily Activity Book, Baby Schedule Tracker, Newborn Log - Perfect Gift for New Moms",http://www.amazon.com/Baby-Tracker-Journal-Newborns-Boy/dp/B07JYBYMGN/ref=sr_1_5?dchild=1&keywords=immunization+record&qid=1589293173&sr=8-5,0
097293751X,"Baby Tracker - Daily Childcare Journal, Schedule Log",http://www.amazon.com/Baby-Tracker%C2%AE-Childcare-Journal-Schedule/dp/097293751X/ref=sr_1_10?dchild=1&keywords=immunization+record&qid=1589293173&sr=8-10,0
B088GNKBTC,"Welcome Grey: Baby's Daily LogBook With Customized name (Grey), Immunizations, Breastfeeding Tracker Journal, health Log Book for newborns, Sleeping, ... Notebook, 8.5 x 11 in, 120 pages, Matte Cover",http://www.amazon.com/dp/B088GNKBTC/ref=sr_1_1?dchild=1&keywords=immunization+record&qid=1589294346&sr=8-1,0
B088GMJZQW,"Welcome Samir: Baby's Daily LogBook With Customized name (Samir), Immunizations, Breastfeeding Tracker Journal, health Log Book for newborns, ... Notebook, 8.5 x 11 in, 120 pages, Matte Cover",http://www.amazon.com/dp/B088GMJZQW/ref=sr_1_2?dchild=1&keywords=immunization+record&qid=1589294346&sr=8-2,0
B088GL5XV1,"Welcome Ramon: Baby's Daily LogBook With Customized name (Ramon), Immunizations, Breastfeeding Tracker Journal, health Log Book for newborns, ... Notebook, 8.5 x 11 in, 120 pages, Matte Cover",http://www.amazon.com/dp/B088GL5XV1/ref=sr_1_3?dchild=1&keywords=immunization+record&qid=1589294346&sr=8-3,0
B088GJ5QW9,"Welcome Kristian: Baby's Daily LogBook With Customized name (Kristian), Immunizations, Breastfeeding Tracker Journal, health Log Book for newborns, ... Notebook, 8.5 x 11 in, 120 pages, Matte Cover",http://www.amazon.com/dp/B088GJ5QW9/ref=sr_1_4?dchild=1&keywords=immunization+record&qid=1589294346&sr=8-4,0
B088GGFKND,"Welcome Tommy: Baby's Daily LogBook With Customized name (Tommy), Immunizations, Breastfeeding Tracker Journal, health Log Book for newborns, ... Notebook, 8.5 x 11 in, 120 pages, Matte Cover",http://www.amazon.com/dp/B088GGFKND/ref=sr_1_5?dchild=1&keywords=immunization+record&qid=1589294346&sr=8-5,0
B088GGFJNZ,"Welcome Ray: Baby's Daily LogBook With Customized name (Ray), Immunizations, Breastfeeding Tracker Journal, health Log Book for newborns, Sleeping, ... Notebook, 8.5 x 11 in, 120 pages, Matte Cover",http://www.amazon.com/dp/B088GGFJNZ/ref=sr_1_6?dchild=1&keywords=immunization+record&qid=1589294346&sr=8-6,0
B088GDG3GG,"Welcome Santana: Baby's Daily LogBook With Customized name (Santana), Immunizations, Breastfeeding Tracker Journal, health Log Book for newborns, ... Notebook, 8.5 x 11 in, 120 pages, Matte Cover",http://www.amazon.com/dp/B088GDG3GG/ref=sr_1_7?dchild=1&keywords=immunization+record&qid=1589294346&sr=8-7,0
B088GNKHJW,"Welcome Yahir: Baby's Daily LogBook With Customized name (Yahir), Immunizations, Breastfeeding Tracker Journal, health Log Book for newborns, ... Notebook, 8.5 x 11 in, 120 pages, Matte Cover",http://www.amazon.com/dp/B088GNKHJW/ref=sr_1_8?dchild=1&keywords=immunization+record&qid=1589294346&sr=8-8,0
B088GNKHJ4,"Welcome Alonso: Baby's Daily LogBook With Customized name (Alonso), Immunizations, Breastfeeding Tracker Journal, health Log Book for newborns, ... Notebook, 8.5 x 11 in, 120 pages, Matte Cover",http://www.amazon.com/dp/B088GNKHJ4/ref=sr_1_9?dchild=1&keywords=immunization+record&qid=1589294346&sr=8-9,0
B088GNKHGY,"Welcome Elisha: Baby's Daily LogBook With Customized name (Elisha), Immunizations, Breastfeeding Tracker Journal, health Log Book for newborns, ... Notebook, 8.5 x 11 in, 120 pages, Matte Cover",http://www.amazon.com/dp/B088GNKHGY/ref=sr_1_10?dchild=1&keywords=immunization+record&qid=1589294346&sr=8-10,0
B00B861JLO,"Prescribed Choice AHCC Capsules, 1500 mg, 60 Count",http://www.amazon.com/Prescribed-Choice-AHCC-Capsules-Count/dp/B00B861JLO/ref=sr_1_10?dchild=1&keywords=vaccine+hpv&qid=1589670484&sr=8-10,0
B0883CGKQW,All Natural Quality of Life Immune and Inflammation Bundle  - Fight Both with Kinoko Platinum AHCC Mushroom Extract and Microactive Curcumin SR,http://www.amazon.com/Natural-Quality-Life-Immune-Inflammation/dp/B0883CGKQW/ref=sr_1_1?dchild=1&keywords=vaccine+hpv&qid=1589672123&sr=8-1,0
1584795018,My Child's Health Journal: Milestones and Memories of the First 12 Years,http://www.amazon.com/My-Childs-Health-Journal-Milestones/dp/1584795018/ref=sr_1_6?dchild=1&keywords=immunization+record+book&qid=1589216264&sr=8-6,0
144131976X,Baby's Book: The First Five Years (Woodland Friends),http://www.amazon.com/Babys-Book-First-Woodland-Friends/dp/144131976X/ref=sr_1_1?dchild=1&keywords=immunization+record+book&qid=1589218223&sr=8-1,0
B088BH5JBX,"My Cat's Health Records: Cat Vaccination Record Book,Health Log Book, Vaccination Reminder Perfect Gift for Cat Owners",http://www.amazon.com/dp/B088BH5JBX/ref=sr_1_1?dchild=1&keywords=immunization+record+book&qid=1589218737&sr=8-1,0
B0889YZ2QF,"Cat Health Record Book: 🐈 To have your cat's medical information at a glance | Follow-up of care, vaccination, deworming, hospitalization, weight, immunization, behaviour and habits | Convenient size",http://www.amazon.com/dp/B0889YZ2QF/ref=sr_1_2?dchild=1&keywords=immunization+record+book&qid=1589218737&sr=8-2,0
B088BM4FBQ,My Health Records: Professional Health Logbook - Personal Organizer to Keep Track of All Your Medical Information and Doctor Visits,http://www.amazon.com/dp/B088BM4FBQ/ref=sr_1_3?dchild=1&keywords=immunization+record+book&qid=1589218737&sr=8-3,0
B088BM4FB7,Personal Health Records & Organizer: Doctor & Hospital Appointments Logbook - Personal Organizer to Keep Track of All Your Medical Information and Doctor Visits,http://www.amazon.com/dp/B088BM4FB7/ref=sr_1_4?dchild=1&keywords=immunization+record+book&qid=1589218737&sr=8-4,0
B088BLHFDP,"My Health Records: Personal Health Record Keeper | Record Your Personal Medical History, Your Doctor & Hospital Visits and Treatment Plans",http://www.amazon.com/dp/B088BLHFDP/ref=sr_1_5?dchild=1&keywords=immunization+record+book&qid=1589218737&sr=8-5,0
B088BJYZ1Z,Medical Records Organizer: Doctor & Hospital Appointments Logbook - Personal Organizer to Keep Track of All Your Medical Information and Doctor Visits,http://www.amazon.com/dp/B088BJYZ1Z/ref=sr_1_6?dchild=1&keywords=immunization+record+book&qid=1589218737&sr=8-6,0
