url_code,title,url,annotation
B07Q5QP4P3,Synthol: The Oil that Cursed Bodybuilding (WE R STUPID Book 40),http://www.amazon.com/Synthol-that-Cursed-Bodybuilding-STUPID-ebook/dp/B07Q5QP4P3/ref=sr_1_9?dchild=1&keywords=vaccination+book&qid=1588582155&sr=8-9,-1
B07VXX9589,"The Doctor Who Fooled the World: Science, Deception, and the War on Vaccines",http://www.amazon.com/Doctor-Who-Fooled-World-Deception-ebook/dp/B07VXX9589/ref=sr_1_3?dchild=1&keywords=vaccination+book&qid=1588585117&sr=8-3,-1
0262539322,Anti-vaxxers: How to Challenge a Misinformed Movement,http://www.amazon.com/Anti-vaxxers-How-Challenge-Misinformed-Movement/dp/0262539322/ref=sr_1_4?dchild=1&keywords=vaccination+book&qid=1588585117&sr=8-4,-1
0300241445,The Great Inoculator: The Untold Story of Daniel Sutton and his Medical Revolution,http://www.amazon.com/Great-Inoculator-Untold-Medical-Revolution/dp/0300241445/ref=sr_1_7?dchild=1&keywords=vaccination+book&qid=1588585117&sr=8-7,-1
0415321794,MMR and Autism: What Parents Need to Know,http://www.amazon.com/MMR-Autism-What-Parents-Need/dp/0415321794/ref=sr_1_1?dchild=1&keywords=mmr+and+autism&qid=1588668331&sr=8-1,-1
B07J1TJWD8,"Vaccines Did Not Cause Rachel's Autism: My Journey as a Vaccine Scientist, Pediatrician, and Autism Dad",http://www.amazon.com/Vaccines-Did-Cause-Rachels-Autism/dp/B07J1TJWD8/ref=sr_1_3?dchild=1&keywords=mmr+and+autism&qid=1588668331&sr=8-3,-1
B00Y300YJK,"[(MMR and Autism)] [Author: Michael Fitzpatrick] published on (August, 2004)",http://www.amazon.com/MMR-Autism-Author-Fitzpatrick-published/dp/B00Y300YJK/ref=sr_1_4?dchild=1&keywords=mmr+and+autism&qid=1588668331&sr=8-4,-1
B000ROKXVA,"Vaccinated: Triumph, Controversy, and An Uncertain F",http://www.amazon.com/Vaccinated-Triumph-Controversy-Uncertain-F-ebook/dp/B000ROKXVA/ref=sr_1_9?dchild=1&keywords=mmr+and+autism&qid=1588668331&sr=8-9,-1
0820488380,"Health, Risk and News: The MMR Vaccine and the Media (Media and Culture)",http://www.amazon.com/Health-Risk-News-Vaccine-Culture/dp/0820488380/ref=sr_1_4?dchild=1&keywords=mmr+and+autism&qid=1588670134&sr=8-4,-1
B0097CWJOM,"Autism's False Prophets: Bad Science, Risky Medicine, and the Search for a Cure",http://www.amazon.com/Autisms-False-Prophets-Science-Medicine-ebook/dp/B0097CWJOM/ref=sr_1_10?dchild=1&keywords=mmr+and+autism&qid=1588670762&sr=8-10,-1
B07SQ1ZT7F,Vaccinated And Proud Vaccinate Vaxx Gift Coffee/tea Ceramic Mug Father Day,http://www.amazon.com/Vaccinated-Vaccinate-Coffee-Ceramic-Father/dp/B07SQ1ZT7F/ref=sr_1_3?dchild=1&keywords=mmr+and+autism&qid=1588671388&sr=8-3&swrs=CE407CAA1733204FC3C510551C0B5671,-1
B07HNDMR3K,"Minglewood Trading Orange - Vaccines Cause Adults - V1-9"" x 6"" Vinyl Decal Sticker - Vax Antivax - 20 Color Options",http://www.amazon.com/Minglewood-Trading-Orange-Vaccines-Sticker/dp/B07HNDMR3K/ref=sr_1_7?dchild=1&keywords=mmr+and+autism&qid=1588671388&sr=8-7&swrs=CE407CAA1733204FC3C510551C0B5671,-1
B07HNVWJQP,"Minglewood Trading Turquoise - Vaccines Cause Adults - V2-12"" x 8"" Vinyl Decal Sticker - Vax Antivax - 20 Color Options",http://www.amazon.com/Minglewood-Trading-Turquoise-Vaccines-Sticker/dp/B07HNVWJQP/ref=sr_1_8?dchild=1&keywords=mmr+and+autism&qid=1588671388&sr=8-8&swrs=CE407CAA1733204FC3C510551C0B5671,-1
B07XKWNM2N,The Vaccines Project,http://www.amazon.com/What-ingredients-are-in-vaccines/dp/B07XKWNM2N/ref=sr_1_1?dchild=1&keywords=vaccine+friendly+plan&qid=1589378890&sr=8-1,-1
B01IUKST0E,Stuff They Don't Want You to Know,http://www.amazon.com/Are-vaccinations-dangerous/dp/B01IUKST0E/ref=sr_1_3?dchild=1&keywords=vaccine+friendly+plan&qid=1589378890&sr=8-3,-1
B077YGV2BM,Vaccination Investigation: The History and Science of Vaccines,http://www.amazon.com/Vaccination-Investigation-History-Science-Vaccines-ebook/dp/B077YGV2BM/ref=sr_1_6?dchild=1&keywords=vaccine+friendly+plan&qid=1589379332&sr=8-6,-1
B07JKFYHXW,Anti/Vax: Reframing the Vaccination Controversy (The Culture and Politics of Health Care Work),http://www.amazon.com/Anti-Vax-Reframing-Vaccination-Controversy-ebook/dp/B07JKFYHXW/ref=sr_1_9?dchild=1&keywords=vaccine+friendly+plan&qid=1589379332&sr=8-9,-1
B07LDMC8BW,Immunization: and your child (Taking Care of your Children Book 1),http://www.amazon.com/Immunization-your-child-Taking-Children-ebook/dp/B07LDMC8BW/ref=sr_1_1?dchild=1&keywords=immunization+record+book&qid=1588600620&sr=8-1,-1
B07RW91CS5,Globalisation of Variolation:The Overlooked Origins of Immunity for Smallpox in the 18th Century,http://www.amazon.com/Globalisation-Variolation-Overlooked-Immunity-Smallpox-ebook/dp/B07RW91CS5/ref=sr_1_3?dchild=1&keywords=immunization+record+book&qid=1588601823&sr=8-3,-1
1786940469,Strangling Angel: Diphtheria and Childhood Immunization in Ireland (Reappraisals in Irish History LUP),http://www.amazon.com/Strangling-Angel-Diphtheria-Immunization-Reappraisals/dp/1786940469/ref=sr_1_4?dchild=1&keywords=immunization+record+book&qid=1588601823&sr=8-4,-1
B07XPCV8GZ,I Got My Flu Shot Stickers 1.5 Inch 500 Total Labels,http://www.amazon.com/Shot-Stickers-Inch-Total-Labels/dp/B07XPCV8GZ/ref=sr_1_4?dchild=1&keywords=flu+shot&qid=1589009429&sr=8-4,-1
B01CCD7VMM,I Love Flu Shots Pinback Button Pin,http://www.amazon.com/Love-Shots-1-25-Pinback-Button/dp/B01CCD7VMM/ref=sr_1_5?dchild=1&keywords=flu+shot&qid=1589010609&sr=8-5,-1
B01CE5LX4K,"I Love Flu Shots 2.25"" Keychain",http://www.amazon.com/Love-Flu-Shots-2-25-Keychain/dp/B01CE5LX4K/ref=sr_1_8?dchild=1&keywords=flu+shot&qid=1589010609&sr=8-8,-1
B07Q8X7MY5,Decal Sticker Multiple Sizes Get Your Flu Shot Today Doctor Office Health & Medical get Your flu Shot here Today Outdoor Store Sign Orange Set of 10,http://www.amazon.com/Sticker-Multiple-Medical-Outdoor-Sign/dp/B07Q8X7MY5/ref=sr_1_1?dchild=1&keywords=flu+shot&qid=1589011643&sr=8-1,-1
B07Q8VMMQR,Decal Sticker Multiple Sizes Get Your Flu Shot Today Doctor Office Health & Medical get Your flu Shot here Today Outdoor Store Sign Orange Set of 10,http://www.amazon.com/Sticker-Multiple-Medical-Outdoor-Sign/dp/B07Q8VMMQR/ref=sr_1_2?dchild=1&keywords=flu+shot&qid=1589011643&sr=8-2,-1
B07Q6ZQH6K,Decal Sticker Multiple Sizes Get Your Flu Shot Today Doctor Office Health & Medical get Your flu Shot here Today Outdoor Store Sign Orange Set of 10,http://www.amazon.com/Sticker-Multiple-Medical-Outdoor-Sign/dp/B07Q6ZQH6K/ref=sr_1_4?dchild=1&keywords=flu+shot&qid=1589011643&sr=8-4,-1
B07Q8YDHR6,Decal Sticker Multiple Sizes Get Your Flu Shot Today Doctor Office Health & Medical get Your flu Shot here Today Outdoor Store Sign Orange Set of 10,http://www.amazon.com/Sticker-Multiple-Medical-Outdoor-Sign/dp/B07Q8YDHR6/ref=sr_1_5?dchild=1&keywords=flu+shot&qid=1589011643&sr=8-5,-1
B07Q8WWZ7V,Decal Sticker Multiple Sizes Get Your Flu Shot Today Doctor Office Health & Medical get Your flu Shot here Today Outdoor Store Sign Orange Set of 10,http://www.amazon.com/Sticker-Multiple-Medical-Outdoor-Sign/dp/B07Q8WWZ7V/ref=sr_1_6?dchild=1&keywords=flu+shot&qid=1589011643&sr=8-6,-1
B07Q8XVNP6,Decal Sticker Multiple Sizes Get Your Flu Shot Today Doctor Office Health & Medical get Your flu Shot here Today Outdoor Store Sign Orange Set of 10,http://www.amazon.com/Sticker-Multiple-Medical-Outdoor-Sign/dp/B07Q8XVNP6/ref=sr_1_7?dchild=1&keywords=flu+shot&qid=1589011643&sr=8-7,-1
B07Q4QZCVZ,Decal Sticker Multiple Sizes Get Your Flu Shot Today Doctor Office Health & Medical get Your flu Shot here Today Outdoor Store Sign Orange Set of 5,http://www.amazon.com/Sticker-Multiple-Medical-Outdoor-Sign/dp/B07Q4QZCVZ/ref=sr_1_8?dchild=1&keywords=flu+shot&qid=1589011643&sr=8-8,-1
B07Q5VDVL9,Decal Sticker Multiple Sizes Get Your Flu Shot Today Doctor Office Health & Medical get Your flu Shot here Today Outdoor Store Sign Orange Set of 10,http://www.amazon.com/Sticker-Multiple-Medical-Outdoor-Sign/dp/B07Q5VDVL9/ref=sr_1_9?dchild=1&keywords=flu+shot&qid=1589011643&sr=8-9,-1
B07Q3SQ9YV,Decal Sticker Multiple Sizes Get Your Flu Shot Today Doctor Office Health & Medical get Your flu Shot here Today Outdoor Store Sign Orange Set of 5,http://www.amazon.com/Sticker-Multiple-Medical-Outdoor-Sign/dp/B07Q3SQ9YV/ref=sr_1_10?dchild=1&keywords=flu+shot&qid=1589011643&sr=8-10,-1
B0885X6HPR,"Cute Keep Calm Get Your Flu Shot Vaccination, Unisex Shirt, Hoodie, Sweatshirt",http://www.amazon.com/Vaccination-Unisex-Shirt-Hoodie-Sweatshirt/dp/B0885X6HPR/ref=sr_1_1?dchild=1&keywords=flu+shot&qid=1589013851&sr=8-1,-1
B087NZG2WS,#vaccine - Men's Soft & Comfortable Hashtag V-Neck T-Shirt,http://www.amazon.com/vaccine-Comfortable-Hashtag-V-Neck-T-Shirt/dp/B087NZG2WS/ref=sr_1_2?dchild=1&keywords=flu+shot&qid=1589013851&sr=8-2,-1
B087P156DD,#vaccination - Men's Soft & Comfortable Hashtag V-Neck T-Shirt,http://www.amazon.com/vaccination-Comfortable-Hashtag-T-Shirt-XX-Large/dp/B087P156DD/ref=sr_1_3?dchild=1&keywords=flu+shot&qid=1589013851&sr=8-3,-1
B08798BPQ3,#vaccination - Men's Soft & Comfortable Hashtag Tank Top,http://www.amazon.com/vaccination-Comfortable-Hashtag-Black-Small/dp/B08798BPQ3/ref=sr_1_6?dchild=1&keywords=flu+shot&qid=1589013851&sr=8-6,-1
B0879BGP6C,#vaccine - Men's Soft & Comfortable Hashtag Tank Top,http://www.amazon.com/vaccine-Comfortable-Hashtag-Black-XX-Large/dp/B0879BGP6C/ref=sr_1_7?dchild=1&keywords=flu+shot&qid=1589013851&sr=8-7,-1
B087LKX32H,#vaccination - Women's Soft & Comfortable Hashtag Deep V-Neck T-Shirt,http://www.amazon.com/vaccination-Comfortable-Hashtag-T-Shirt-X-Large/dp/B087LKX32H/ref=sr_1_10?dchild=1&keywords=flu+shot&qid=1589013851&sr=8-10,-1
B07QKR1XGK,DECAL MERCH Vaccinate Your Crotch Goblins Decal Funny Sticker for Car or Truck Window,http://www.amazon.com/OhioDecals-com-Vaccinate-Crotch-Goblins-Sticker/dp/B07QKR1XGK/ref=sr_1_1?dchild=1&keywords=vaccinate&qid=1589428835&sr=8-1,-1
B086B8MM71,Reasons to Vaccinate: Proof That Vaccines Save Lives,http://www.amazon.com/Reasons-Vaccinate-Proof-Vaccines-Lives/dp/B086B8MM71/ref=sr_1_2?dchild=1&keywords=vaccinate&qid=1589428835&sr=8-2,-1
B07ZS1Q8LQ,Vaccinate With Love,http://www.amazon.com/Vaccinate-Love-Peter-Lake/dp/B07ZS1Q8LQ/ref=sr_1_6?dchild=1&keywords=vaccinate&qid=1589428835&sr=8-6,-1
B07Z8RMRNC,Foreen Vaccinate Your Crotch Goblins Funny Car Vehicle Reflective Decal Stickers Decoration,http://www.amazon.com/Foreen-Vaccinate-Reflective-Stickers-Decoration/dp/B07Z8RMRNC/ref=sr_1_7?dchild=1&keywords=vaccinate&qid=1589428835&sr=8-7,-1
B07SKC85H3,"Black Heart Decals & More Vaccinate Your Crotch Goblins Vinyl Decal Sticker | Color: White | 7"" x 2.3""",http://www.amazon.com/Black-Heart-Decals-More-Vaccinate/dp/B07SKC85H3/ref=sr_1_8?dchild=1&keywords=vaccinate&qid=1589428835&sr=8-8,-1
B07T2M9QFQ,Vaccines Cause Adults | Funny Doctor Nurse Science Humor V-Neck T-Shirt for Women,http://www.amazon.com/Vaccines-Adults-Doctor-Science-T-Shirt/dp/B07T2M9QFQ/ref=sr_1_9?dchild=1&keywords=vaccinate&qid=1589428835&sr=8-9,-1
B07HND8KYQ,"Minglewood Trading Yellow - Vaccines Cause Adults - V1-6"" x 4"" Vinyl Decal Sticker - Vax Antivax - 20 Color Options",http://www.amazon.com/Minglewood-Trading-Yellow-Vaccines-Sticker/dp/B07HND8KYQ/ref=sr_1_10?dchild=1&keywords=vaccinate&qid=1589428835&sr=8-10,-1
B07ZRFPSJF,"856store-Wall Art Graffiti Vinyl Sticker | Urban Art Window, Car, Laptop Decal,Vaccinate Your Crotch Goblins Funny Car Vehicle Reflective Decals Sticker Decor - White",http://www.amazon.com/856store-Wall-Graffiti-Sticker-Vaccinate-Reflective/dp/B07ZRFPSJF/ref=sr_1_3?dchild=1&keywords=vaccinate&qid=1589429964&sr=8-3,-1
B07ZS2M1WP,Vaccinate With Love,http://www.amazon.com/Vaccinate-With-Love/dp/B07ZS2M1WP/ref=sr_1_7?dchild=1&keywords=vaccinate&qid=1589429964&sr=8-7,-1
B07TYZXRDK,Vaccinate Your Crotch Goblins Zip Hoodie,http://www.amazon.com/Vaccinate-Your-Crotch-Goblins-Hoodie/dp/B07TYZXRDK/ref=sr_1_1?dchild=1&keywords=vaccinate&qid=1589430930&sr=8-1,-1
B07YJT87WX,Funny Vaccinate Your Crotch Goblins Pro Vaccine Doctor Nurse Pullover Hoodie,http://www.amazon.com/Funny-Vaccinate-Goblins-Vaccine-Pullover/dp/B07YJT87WX/ref=sr_1_2?dchild=1&keywords=vaccinate&qid=1589430930&sr=8-2,-1
B084V92KJ7,IRISH youd vaccinate funny provax medical Premium T-Shirt,http://www.amazon.com/vaccinate-provax-medical-Premium-T-Shirt/dp/B084V92KJ7/ref=sr_1_6?dchild=1&keywords=vaccinate&qid=1589430930&sr=8-6,-1
B07ZGRMQ1K,Funny Pro Vaccination Anti-Karen Vaccinate Your Kids Tank Top,http://www.amazon.com/Funny-Pro-Vaccination-Anti-Karen-Vaccinate/dp/B07ZGRMQ1K/ref=sr_1_7?dchild=1&keywords=vaccinate&qid=1589430930&sr=8-7,-1
B07NPXKC9L,"Vaccinate - Don't Wait Vaccinate - 2.25"" Pinback Buttons - Pack of 10",http://www.amazon.com/Vaccinate-Dont-Wait-Pinback-Buttons/dp/B07NPXKC9L/ref=sr_1_8?dchild=1&keywords=vaccinate&qid=1589430930&sr=8-8,-1
B0139IVKZI,Inspired Silver - Silver Pave Heart Charm French Hook Drop Earrings with Cubic Zirconia Jewelry,http://www.amazon.com/Vaccinate-Earrings-French-Crystal-Rhinestones/dp/B0139IVKZI/ref=sr_1_1?dchild=1&keywords=vaccinate&qid=1589431600&sr=8-1,-1
B012GZWCHK,Inspired Silver - Silver Pave Heart Charm Bracelet with Cubic Zirconia Jewelry,http://www.amazon.com/Vaccinate-Bracelet-Silver-Lobster-Crystal/dp/B012GZWCHK/ref=sr_1_2?dchild=1&keywords=vaccinate&qid=1589431600&sr=8-2,-1
B018S43W68,Inspired Silver - Vaccinate Charm Ornament - Silver Pave Heart Charm Holiday Ornaments with Cubic Zirconia Jewelry,http://www.amazon.com/Inspired-Silver-Vaccinate-Decoration-Christmas/dp/B018S43W68/ref=sr_1_5?dchild=1&keywords=vaccinate&qid=1589431600&sr=8-5,-1
B07S1XYDBT,Inspired Silver - Vaccinate Charm Ornament - Gold Pave Heart Charm Holiday Ornaments with Cubic Zirconia Jewelry,http://www.amazon.com/Inspired-Silver-Vaccinate-Ornament-Ornaments/dp/B07S1XYDBT/ref=sr_1_6?dchild=1&keywords=vaccinate&qid=1589431600&sr=8-6,-1
B07QMF34JT,Vaccinate your Crotch Goblins Car Decal!,http://www.amazon.com/Vaccinate-your-Crotch-Goblins-Decal/dp/B07QMF34JT/ref=sr_1_10?dchild=1&keywords=vaccinate&qid=1589431600&sr=8-10,-1
B088KCSW7L,Lplpol Premium Anti-Dust Vinyl Decal Jesus Vaccinates Nurse Med Atheist Atheism Satire Sarcasm Vax Vaccine Vaccination/Vinyl Sticker Decal Bumper Laptop Car Window Art Gift 6 Inches,http://www.amazon.com/dp/B088KCSW7L/ref=sr_1_1?dchild=1&keywords=vaccinate&qid=1589432624&sr=8-1,-1
B088FT7RRF,The Vaccinate hpv Measles Tuberculosis pneumococcal Shirt,http://www.amazon.com/Vaccinate-Measles-Tuberculosis-pneumococcal-Shirt/dp/B088FT7RRF/ref=sr_1_2?dchild=1&keywords=vaccinate&qid=1589432624&sr=8-2,-1
B0886LKV5T,"Baobungto T-shirt Vaccinate Immunize Vaccine Babies Mother Epidemic Virus Classic Unisex T-Shirt, Hoodie, Sweatshirt, Gift For Men Women",http://www.amazon.com/Baobungto-Vaccinate-Immunize-Epidemic-Sweatshirt/dp/B0886LKV5T/ref=sr_1_5?dchild=1&keywords=vaccinate&qid=1589432624&sr=8-5,-1
B0886LLMD6,Vaccinate Your Spawn Black/Dad Birthday Gift Lead Free Ceramic 11OZ Personalized Tea Mug,http://www.amazon.com/Vaccinate-Spawn-Birthday-Ceramic-Personalized/dp/B0886LLMD6/ref=sr_1_6?dchild=1&keywords=vaccinate&qid=1589432624&sr=8-6,-1
B0886KR151,"Vaccinate your children / 11oz White Ceramic Mug, Made In USA, Housewarming Gift, Birthday Gift, Funny Meme Gift",http://www.amazon.com/Vaccinate-children-Ceramic-Housewarming-Birthday/dp/B0886KR151/ref=sr_1_7?dchild=1&keywords=vaccinate&qid=1589432624&sr=8-7,-1
B0886KG5JY,Vaccinate Your Spawn White/Dad Birthday Gift Lead Free Ceramic 11OZ Personalized Tea Mug,http://www.amazon.com/Vaccinate-Spawn-Birthday-Ceramic-Personalized/dp/B0886KG5JY/ref=sr_1_8?dchild=1&keywords=vaccinate&qid=1589432624&sr=8-8,-1
B0886KJCPL,"Virtrikatitte Shirt That’s What I Do I Vaccinate My Kids And I Know Things, Unisex Shirt, Hoodie, Sweatshirt.",http://www.amazon.com/Virtrikatitte-Vaccinate-Things-Unisex-Sweatshirt/dp/B0886KJCPL/ref=sr_1_9?dchild=1&keywords=vaccinate&qid=1589432624&sr=8-9,-1
B08865WB8N,Vaccinate HPV Measles Tuberculosis Pneumococcal Diphtheria Shingles Tetanus Hepatitis Rubella T-Shirt Long Sleeve Sweatshirt Hoodie,http://www.amazon.com/Vaccinate-Tuberculosis-Pneumococcal-Diphtheria-Sweatshirt/dp/B08865WB8N/ref=sr_1_10?dchild=1&keywords=vaccinate&qid=1589432624&sr=8-10,-1
B00HJ1JWZM,The Great Culling: Our Water,http://www.amazon.com/Great-Culling-Our-Water/dp/B00HJ1JWZM/ref=sr_1_1?dchild=1&keywords=rabies+vaccine&qid=1588825290&sr=8-1,-1
B07XPF76LD,The Vaccines Project,http://www.amazon.com/200-years-of-vaccine-skepticism/dp/B07XPF76LD/ref=sr_1_3?dchild=1&keywords=rabies+vaccine&qid=1588825290&sr=8-3,-1
0898383900,Rabies (Developments in Veterinary Virology (7)),http://www.amazon.com/J-B-Campbell/dp/0898383900/ref=sr_1_3?dchild=1&keywords=rabies+vaccine&qid=1588826420&sr=8-3,-1
B0885WBR5S,Rabies and Rabies Vaccines,http://www.amazon.com/dp/B0885WBR5S/ref=sr_1_4?dchild=1&keywords=rabies+vaccine&qid=1588828430&sr=8-4,-1
B017USKQBW,"Immunization II Guide - Pocket Chart - 4.5"" x 6.75"" Laminated Medical Quick Reference Guide by Permacharts",http://www.amazon.com/Immunization-Guide-Laminated-Reference-Permacharts/dp/B017USKQBW/ref=sr_1_2?dchild=1&keywords=immunization&qid=1588788932&sr=8-2,-1
B07D3BLMXT,Immunization: How Vaccines became Controversial,http://www.amazon.com/Immunization-How-Vaccines-became-Controversial-ebook/dp/B07D3BLMXT/ref=sr_1_4?dchild=1&keywords=immunization&qid=1588788932&sr=8-4,-1
B00TFTS194,Immunization Poster 1979 Vintage Star Wars C-3PO R2-D2 Original,http://www.amazon.com/Immunization-Vintage-Star-Wars-Original/dp/B00TFTS194/ref=sr_1_5?dchild=1&keywords=immunization&qid=1588788932&sr=8-5,-1
B07PHW2QVZ,"Child, Adolescents, and Adult Immunization Schedules",http://www.amazon.com/Child-Adolescents-Adult-Immunization-Schedules-ebook/dp/B07PHW2QVZ/ref=sr_1_2?dchild=1&keywords=immunization&qid=1588790241&sr=8-2&swrs=E2E34BEB375D235982016E2AFF92966E,-1
B00K8LGDU2,Vaccinations: The Risk of Misinformation,http://www.amazon.com/Vaccinations-Risk-Misinformation-C-D-Shelton-ebook/dp/B00K8LGDU2/ref=sr_1_7?dchild=1&keywords=immunization&qid=1588790241&sr=8-7&swrs=E2E34BEB375D235982016E2AFF92966E,-1
B00BA4RJ0Y,Pediatric Vaccination - a (provax) pediatrician's perspective,http://www.amazon.com/Pediatric-Vaccination-provax-pediatricians-perspective-ebook/dp/B00BA4RJ0Y/ref=sr_1_9?dchild=1&keywords=immunization&qid=1588790241&sr=8-9&swrs=E2E34BEB375D235982016E2AFF92966E,-1
B00TJHK974,Measles: What You Need To Know,http://www.amazon.com/Measles-What-You-Need-Know-ebook/dp/B00TJHK974/ref=sr_1_10?dchild=1&keywords=immunization&qid=1588790241&sr=8-10&swrs=E2E34BEB375D235982016E2AFF92966E,-1
9290612479,Preventing Mother-to-child Transmission of Hepatitis B: Operational Field Guidelines for Delivery of Birth Dose of Hepatitis B Vaccine (Public Health),http://www.amazon.com/Preventing-Mother-child-Transmission-Hepatitis/dp/9290612479/ref=sr_1_5?dchild=1&keywords=immunization&qid=1588791424&sr=8-5&swrs=EA79CA51872BD236FAAD37647EB6AB1B,-1
9241549092,Immunization in Practice: A Practical Guide for Health Staff,http://www.amazon.com/Immunization-Practice-Practical-Guide-Health/dp/9241549092/ref=sr_1_7?dchild=1&keywords=immunization&qid=1588791424&sr=8-7&swrs=EA79CA51872BD236FAAD37647EB6AB1B,-1
9290617462,Vaccine Safety Communication: Guide for Immunization Programme Managers and National Regulatory Authorities (Public Health),http://www.amazon.com/Vaccine-Safety-Communication-Immunization-Authorities/dp/9290617462/ref=sr_1_10?dchild=1&keywords=immunization&qid=1588791424&sr=8-10&swrs=EA79CA51872BD236FAAD37647EB6AB1B,-1
B085RPN1QZ,A Good Time to Be Born: How Science and Public Health Gave Children a Future,http://www.amazon.com/Good-Time-Be-Born-Children-ebook/dp/B085RPN1QZ/ref=sr_1_1?dchild=1&keywords=immunization&qid=1588793857&sr=8-1,-1
B086ZHMR66,Qualitative insights into reasons for missed opportunities for vaccination in Kenyan health facilities,http://www.amazon.com/Qualitative-insights-opportunities-vaccination-facilities-ebook/dp/B086ZHMR66/ref=sr_1_8?dchild=1&keywords=immunization&qid=1588793857&sr=8-8,-1
1441911073,Vaccines: A Biography,http://www.amazon.com/Vaccines-Biography-Andrew-W-Artenstein/dp/1441911073/ref=sr_1_3?dchild=1&keywords=hepatitis+a+vaccine&qid=1589176832&sr=8-3,-1
B00MU1AZQQ,Vaccine Nation: America's Changing Relationship with Immunization,http://www.amazon.com/Vaccine-Nation-Americas-Relationship-Immunization-ebook/dp/B00MU1AZQQ/ref=sr_1_8?dchild=1&keywords=hepatitis+a+vaccine&qid=1589176832&sr=8-8,-1
1455700908,Vaccines: Expert Consult - Online and Print (Vaccines (Plotkin)),http://www.amazon.com/Vaccines-Expert-Consult-Plotkin-Orenstein/dp/1455700908/ref=sr_1_4?dchild=1&keywords=hepatitis+a+vaccine&qid=1589178304&sr=8-4,-1
161002463X,Pediatric Vaccines: A Clinical Decision Support Chart: A Clinical Decision Support Chart,http://www.amazon.com/Pediatric-Vaccines-Clinical-Decision-Support/dp/161002463X/ref=sr_1_1?dchild=1&keywords=hepatitis+a+vaccine&qid=1589178754&sr=8-1,-1
B01L2GOT1G,Eliminating the Public Health Problem of Hepatitis B and C in the United States: Phase One Report,http://www.amazon.com/Eliminating-Public-Health-Problem-Hepatitis-ebook/dp/B01L2GOT1G/ref=sr_1_6?dchild=1&keywords=hepatitis+a+vaccine&qid=1589178754&sr=8-6,-1
B07HYD7PKW,"Defeating the Ministers of Death: The compelling story of vaccination, one of medicine's greatest triumphs",http://www.amazon.com/Defeating-Ministers-Death-David-Isaacs-ebook/dp/B07HYD7PKW/ref=sr_1_6?dchild=1&keywords=gardasil&qid=1588824037&sr=8-6,-1
1973930587,"Good News About Women And HPV: How to protect your health, the health of your children, and your relationship with your partner.",http://www.amazon.com/Good-News-About-Women-HPV/dp/1973930587/ref=sr_1_5?dchild=1&keywords=gardasil&qid=1588824502&sr=8-5&swrs=BB8757E54F6C8EDF538616E443A0B3E5,-1
B01C7UC2BK,The Human Papillomavirus (HPV): Full Illustrated 2016,http://www.amazon.com/Human-Papillomavirus-HPV-Full-Illustrated-ebook/dp/B01C7UC2BK/ref=sr_1_7?dchild=1&keywords=gardasil&qid=1588824502&sr=8-7&swrs=BB8757E54F6C8EDF538616E443A0B3E5,-1
B087ZWF3N5,One Legging it Around #Vacuna - Hashtag Leather Dark Brown Patch Engraved Trucker Hat,http://www.amazon.com/Vacuna-Hashtag-Leather-Engraved-Heather-White/dp/B087ZWF3N5/ref=sr_1_1?dchild=1&keywords=gardasil&qid=1588825909&sr=8-1,-1
B086Z5VTYR,"#vacuna - 12oz Hashtag Camping Mug Stainless Steel, Black",http://www.amazon.com/vacuna-Hashtag-Camping-Stainless-Steel/dp/B086Z5VTYR/ref=sr_1_3?dchild=1&keywords=gardasil&qid=1588825909&sr=8-3,-1
B086Z677RM,"#vaccine - 12oz Hashtag Camping Mug Stainless Steel, Black",http://www.amazon.com/vaccine-Hashtag-Camping-Stainless-Steel/dp/B086Z677RM/ref=sr_1_5?dchild=1&keywords=gardasil&qid=1588825909&sr=8-5,-1
B086Z73BS7,"#vaccination - 12oz Hashtag Camping Mug Stainless Steel, Black",http://www.amazon.com/vaccination-Hashtag-Camping-Stainless-Steel/dp/B086Z73BS7/ref=sr_1_6?dchild=1&keywords=gardasil&qid=1588825909&sr=8-6,-1
B0054TQATW,A Long Time Dead: The Dead Trilogy (Roger Conniston Book 1),http://www.amazon.com/Long-Time-Dead-Roger-Conniston-ebook/dp/B0054TQATW/ref=sr_1_2?dchild=1&keywords=andrew+wakefield&qid=1588608538&sr=8-2,-1
B083XVFXZS,Andrew Wakefield Reminder Blank Lined Notebook/Journal for Bioethics Students,http://www.amazon.com/Wakefield-Reminder-Notebook-Bioethics-Students/dp/B083XVFXZS/ref=sr_1_9?dchild=1&keywords=andrew+wakefield&qid=1588608538&sr=8-9,-1
B085F37NRV,KENNETHHOFFMAN 3 PCs Stickers Pro Vaccine | Got Polio Me Neither Gift 3×4 Inch Die-Cut Wall Decals for Laptop Window Car Bumper Helmet Water Bottle,http://www.amazon.com/KENNETHHOFFMAN-Stickers-Vaccine-Neither-Die-Cut/dp/B085F37NRV/ref=sr_1_4?dchild=1&keywords=hepatitis+vaccine&qid=1588637614&sr=8-4&swrs=CB4F9EA097429568B217C1CCE756ADDF,-1
B07ZWDNPFM,One Legging it Around #Vaccine - Hashtag Soft Adult Beanie Cap,http://www.amazon.com/One-Legging-Around-Vaccine-Hashtag/dp/B07ZWDNPFM/ref=sr_1_8?dchild=1&keywords=hepatitis+vaccine&qid=1588637614&sr=8-8&swrs=CB4F9EA097429568B217C1CCE756ADDF,-1
B088JVX3PB,"Emeldateeco Drink Up Witches Halloween Tshirt Hoodies Tank Top Unisex T-Shirt, Hoodie, Sweatshirt for Men Women",http://www.amazon.com/dp/B088JVX3PB/ref=sr_1_1?dchild=1&keywords=flu+shot&qid=1589445896&sr=8-1,-1
B088FG1NF9,Cute Keep Calm Get Your Flu Shot Vaccination Shirt,http://www.amazon.com/Cute-Keep-Calm-Vaccination-Shirt/dp/B088FG1NF9/ref=sr_1_5?dchild=1&keywords=flu+shot&qid=1589445896&sr=8-5,-1
B009NG3A2M,Do You Believe in Magic?: The Sense and Nonsense of Alternative Medicine,http://www.amazon.com/Do-You-Believe-Magic-Alternative-ebook/dp/B009NG3A2M/ref=sr_1_7?dchild=1&keywords=wakefield+autism&qid=1589550466&sr=8-7,-1
B005DC7012,"The New York Times Magazine, April 24, 2011: Why She Went: When Barry (Barack) Obama was 6, his mother (Stanley Ann Dunham) moved him to Indonesia, a decision that would define his life & hers /Denunciation of Dr. Wakefield & vaccine theory of autism",http://www.amazon.com/York-Times-Magazine-April-2011/dp/B005DC7012/ref=sr_1_5?dchild=1&keywords=wakefield+autism&qid=1589550971&sr=8-5,-1
B01D8X6RP2,"The MMR vaccine: Public health, private fears",http://www.amazon.com/MMR-vaccine-Public-health-private-ebook/dp/B01D8X6RP2/ref=sr_1_2?dchild=1&keywords=mmr+vaccine&qid=1589458963&sr=8-2,-1
B016YJACQM,"Epidemiology and Prevention of Vaccine-Preventable Diseases, 13th Edition: The Pink Book",http://www.amazon.com/Epidemiology-Prevention-Vaccine-Preventable-Diseases-13th-ebook/dp/B016YJACQM/ref=sr_1_4?dchild=1&keywords=mmr+vaccine&qid=1589458963&sr=8-4,-1
B006WX9H3U,"Bad Science: Quacks, Hacks, and Big Pharma Flacks",http://www.amazon.com/Bad-Science-Ben-Goldacre-audiobook/dp/B006WX9H3U/ref=sr_1_5?dchild=1&keywords=mmr+vaccine&qid=1589458963&sr=8-5,-1
B01MRGZ4MV,X-Plain ® Vaccines for Kids,http://www.amazon.com/X-Plain-Vaccines-Kids-S-F-Haddad-ebook/dp/B01MRGZ4MV/ref=sr_1_2?dchild=1&keywords=mmr+vaccine&qid=1589460673&sr=8-2,-1
B000OT83A6,MMR and Autism: What Parents Need to Know,http://www.amazon.com/MMR-Autism-What-Parents-Need-ebook/dp/B000OT83A6/ref=sr_1_6?dchild=1&keywords=mmr+vaccine&qid=1589461722&sr=8-6,-1
